Id,Channel,Category,Title,View Count
L-jMOTYWCgU,Hardware Canucks,Tech,NZXT X62 & X52... Best looking AIOs Ever Made!,1254863
UEwagWXt_tc,Hardware Canucks,Tech,OnePlus 7T vs 7 Pro - We Have A WINNER!,1248531
9zMOrX3MM-s,Hardware Canucks,Tech,TOP CASES OF 2016,1215281
OwNr_WCpzRc,Hardware Canucks,Tech,Building The ULTIMATE USB Flash Drive!,1220213
w6YLj12s1e4,Hardware Canucks,Tech,This Dial Controls Everything! -- Logitech Craft Keyboard,1250708
jEO8CTpEzbg,Hardware Canucks,Tech,GAMING at 240Hz ... My Experience!,1199973
zoEvVmU5eC4,Hardware Canucks,Tech,3 Months With Ryzen 7 - Was The Switch Worth It?,1174793
7e_yVm-vcPM,Hardware Canucks,Tech,7.1 Surround Sound - HEAR IT YOURSELF!,1166099
Pv_5VTrHyqY,Hell's Kitchen,Food,Gordon Ramsay In Awe Over Culinary Teacher Not Having Any Experience | Hell's Kitchen,18918711
oxH-0n-SpYQ,Hell's Kitchen,Food,Customer IMMEDIATELY Regrets Complaining To Ramsay | Hell's Kitchen,13987186
H8On7sHjsng,Hell's Kitchen,Food,The WORST Signature Dishes In Hell's Kitchen | Part One,16151400
ddzRE69bIZ8,Hell's Kitchen,Food,Gordon Ramsay High Fives Chefs Over A Great Service | Hell's Kitchen,13715497
CgqudioHmTE,Hell's Kitchen,Food,EVERY Raj Moment on Hell's Kitchen,15548522
VRnEpEcWieU,Hell's Kitchen,Food,The WORST Signature Dishes Part Two | Hell's Kitchen,14185485
JeswElZRJ_Y,Hell's Kitchen,Food,Gordon Ramsay Loving The Food! | Hell's Kitchen | Part One,12324042
YMRfZHIGhMg,Hell's Kitchen,Food,Chicken Soup Impresses Gordon! | Hell's Kitchen,11578801
p7PwQPdWw4Y,Hell's Kitchen,Food,The FUNNIEST Moments of Season 1 | Hell's Kitchen,11606186
1gTWfV1QQ-s,Hell's Kitchen,Food,Gordon Ramsay Has Enough & Cooks The Final Table Himself | Hell's Kitchen,8468634
EudiumXdN7c,Hell's Kitchen,Food,Chef Gets Raw Fish Past Gordon Ramsay | Hell's Kitchen,8609543
3DkOxyBghN8,Hell's Kitchen,Food,"Gordon Gets Angry Over Matt Telling Him To ""Shut Up"" | Hell's Kitchen",8516328
0cJH8_0M-bE,Hell's Kitchen,Food,Chef Tries HIDING Burnt Meat From Gordon | Hell's Kitchen,8195637
oZcKT37EsMs,Hell's Kitchen,Food,The Most Intense Moments On Hell's Kitchen | Part One,11079338
k82iqndlfbA,Hell's Kitchen,Food,Chef Eats More Food Than The Customers | Hell's Kitchen,8456233
cvLbjQ11GAM,Hell's Kitchen,Food,The Best Moments Of Hell's Kitchen Season 14,7739466
6m3SJMz2LRU,Hell's Kitchen,Food,The BEST Moments of Series 13 on Hell's Kitchen,8479798
YJlOmF0HK9w,Hell's Kitchen,Food,Melissa Tries Sabotaging Her Team | Hell's Kitchen,9684828
Fte3ey3L-48,Hell's Kitchen,Food,9 Minutes of Gordon Losing His Temper | Hell's Kitchen,11328297
XYFLK8gXMRU,Hell's Kitchen,Food,Gordon's Politest Customer Interaction | Hell's Kitchen,13981037
JpLJY0s9a2A,Hell's Kitchen,Food,Gordon Ramsay Going Absolutely Berserk | Hell's Kitchen,8573398
c7i3rprLMJw,Hell's Kitchen,Food,The BEST Moments From Hell's Kitchen Season 15,7167664
iaEcZW0eyEg,Hell's Kitchen,Food,Gordon Ramsay's Most Savage Moments | Hell's Kitchen | Part One,11743150
2JOqNqoaQ70,Hell's Kitchen,Food,"""You Can't Win So You Try To Set The Place On Fire?"" | Hell's Kitchen",7110341
voIlMkwvybI,Hell's Kitchen,Food,Gordon Ramsay Loves Chef's Porterhouse Steak | Hell's Kitchen,7249648
nMUuSGRIk9I,Hell's Kitchen,Food,"""From The Bottom Of My Heart, Shut Up!"" | Hell's Kitchen",7278846
cQfNoSHlud0,Hell's Kitchen,Food,Two Chefs Trick Chef Scott | Hell's Kitchen,6641219
pv8s9dGQ0l4,Hell's Kitchen,Food,The Best of Gordon Ramsay | Hell's Kitchen Part One,8099375
KZHiIVMIbF4,Hell's Kitchen,Food,Chef Asks If He Should Put TUNA In A VEGETARIAN'S Salad | Hell's Kitchen,5844014
SvQ7rmr3mow,Hell's Kitchen,Food,Chef Somehow Mistakes Potato For An Egg | Hell's Kitchen,6752879
b_yCj6fXtlA,Incognito Mode,Blog,The CNN Skirmishes | Meme Insider Collaboration,7157689
i520aRuZXLo,Incognito Mode,Blog,Jeff The Killer - Creepypasta | Sundance Rejects,6692970
iPlFdIpgioI,Incognito Mode,Blog,The Swedish Job | Sundance Rejects,6681217
CwF8DYf5dDc,Incognito Mode,Blog,architecture.,6902383
y4mYPMvEbcQ,Incognito Mode,Blog,monsters.,6317787
h-h9cpm1vD8,Incognito Mode,Blog,Exploring the Japanese Kitkat Forest [Old ITF],5265272
vrGf4nJWVOU,Incognito Mode,Blog,The Gentleman Pirate | Sundance Rejects,6188889
sPUKxtLHPKQ,Incognito Mode,Blog,There Are No Hot Singles In Your Area [Old ITF],4517496
Zx-SY1a_8qk,Incognito Mode,Blog,art.,5487154
wTziIhu8yvU,Incognito Mode,Blog,etiquette.,5870001
oDYB4ZZLkmY,Incognito Mode,Blog,weapons.,7540236
PeACT6GHBh8,Incognito Mode,Blog,mythology.,5900030
5vfZqByi808,Incognito Mode,Blog,The Failure of Dashcon: Q & A,3946176
MU1_QlN3Z98,Incognito Mode,Blog,food.,5293663
8Sn286tPtDE,Incognito Mode,Blog,fashion.,4602297
xw6xB7f2LEs,Incognito Mode,Blog,ads.,5048648
Q11jwThxBBI,Incognito Mode,Blog,Sonic High School | Sundance Rejects,3512736
BGIuPAG2VrM,Incognito Mode,Blog,travel.,4470058
z8aM_P0qT3o,Incognito Mode,Blog,survival.,5025835
rXAeb7Pmzjs,Incognito Mode,Blog,KONY Q&A,2879483
MoOvPtI5M4k,Incognito Mode,Blog,Confirming Half-life 3 [Old ITF],2550939
VT128ElBWkM,Incognito Mode,Blog,The Roswell Incident,2358380
SiZ4VkqhGT8,Incognito Mode,Blog,Can You Force a Meme [Old ITF],2266366
KhQL58CYyRQ,Incognito Mode,Blog,spooky.,5031028
Xh6rc-t47rQ,Incognito Mode,Blog,A Lesson in YTP [Old ITF],2417661
eRjnPwoxSWU,Incognito Mode,Blog,Samples from the SCP Files [Old ITF],2380505
INq3d89XxFI,Incognito Mode,Blog,Habbo Hotel Anniversary Special,2134582
U6Crdz7Uo7c,Incognito Mode,Blog,Costa Concordia Q&A,3163740
Tgp2cZd1sB0,Incognito Mode,Blog,BlackPanther1080pHDFREEHindiSubsEnglishNew2018 [Old ITF],2210827
l554kV12Wuo,Insider News,News,Prisoners In Finland Live In Open Prisons Where They Learn Tech Skills | On The Ground,16682038
E0WT1HtB-Sc,Insider News,News,Why Miners Risk Their Lives To Get Sulfur From An Active Volcano | Risky Business,19881174
yPsYOnGPOZk,Insider News,News,How Olive Oil Soap Is Made In One Of The Last Factories In The West Bank,7013589
3TitHNx0l3w,Insider News,News,How Apples Are Made In A Lab,3202029
P69xdkqBJno,Insider News,News,Highlights From Trump And Biden's Chaotic First Presidential Debate,6264631
gCG52EeOv38,Insider News,News,"How States Voted In Every Presidential Election, From George Washington To Donald Trump",3803660
jpQqr3JQs84,Insider News,News,What It's Like To Work At A Crematorium In India As The Death Toll Mounts,2120173
HkPatmQFLXU,Insider News,News,How UPS Trains Drivers To Safely Deliver 21 Million Packages A Day,1992473
kU-M44tWm64,Insider News,News,Video Captures Massive Volcanic Eruption In Tonga,1717891
P9FXWmwvri4,Insider News,News,How The Ever Given Finally Made It Through The Suez Canal,1577183
L5hksM_R59M,Insider News,News,New Footage Shows What It Was Like Inside The Trump Mob At The Capitol | On The Ground,1476952
Honkq3fKFoA,Insider News,News,We Asked Trump Voters What Happens If He Loses,1381485
j9n5rlgnbjI,Insider News,News,What Election Night Looked Like In Trump's And Biden's Backyards | Beyond The Headlines,1356718
4uInE0P4Io0,Insider News,News,3 Coronavirus Patients Share Stories From Testing And Quarantine,1069908
CH4TaEFtcvc,Insider News,News,"Americans React To Joe Biden Becoming President Elect, From Celebrations To Protests",1130457
ADb60W8jTsM,Insider News,News,Inside Poland's 'LGBT-Free' Zones | Insider Docs,1656050
Y3DEpThhyeY,Insider News,News,Where Everyone Moved During The Pandemic | Maps And Data,911498
7box15ryvx8,Insider News,News,How Did Jeffrey Epstein’s Phone Book End Up On A Farm In Vermont | Insider Docs,1700949
Zczmz4850wM,Insider News,News,We Decoded The Guns People Bring To Protests And Rallies Across the US | Decoded,2683462
F576tDLa10E,Insider News,News,Why A Coronavirus Vaccine Could Be Developed In Record Time,735782
S_0geClYYJI,Insider News,News,Elon Musk's Wealth Compared To Everything | Data On Data,733746
gwqEgvSkT_c,Insider News,News,Protests Against COVID-19 Restrictions Rock Belgium,628085
CoDpjqZpAh0,Insider News,News,We Decoded The Nuclear Weapons At North Korea's Military Parades | Decoded,852195
IZpiUSU4VOI,Insider News,News,Bats Still For Sale As COVID-19 Rages | On The Ground,564875
hxv1-twWRGk,Insider News,News,Why MMA Fighters In Afghanistan Fear The Return Of The Taliban,567275
UCq_cDPeY1k,Insider News,News,Vineyard Workers Race Overnight To Save Grapes From Approaching Fires | California Wildfires,586155
kjyeCdd-dl8,Internet Historian,"Comedy,Informative",The Fall of 76,36191440
O5BJVO3PDeQ,Internet Historian,"Comedy,Informative",The Engoodening of No Man's Sky,23959476
1ZgxeX2dCnQ,Internet Historian,"Comedy,Informative",The Failure of Dashcon | The world's first Tumblr convention,19305674
GmULc5VANsw,Internet Historian,"Comedy,Informative",The Failure of Rainfurrest,19465135
UBPg5ftCMv8,Internet Historian,"Comedy,Informative",The Failure of Fyre Festival,19533063
ROaj3bCpZEM,Internet Historian,"Comedy,Informative",Very Serious Business,18346304
Qh9KBwqGxTI,Internet Historian,"Comedy,Informative",The Cost of Concordia,20725716
MQEEJ57Gsow,Internet Historian,"Comedy,Informative",The Great iPhone Massacre,13694488
Y7nymZEXjf8,Internet Historian,"Comedy,Informative",The Story of Kony2012,14361048
QynNpzqYt0Y,Internet Historian,"Comedy,Informative",Going Camping at the End of the World,14704709
SvjwXhCNZcU,Internet Historian,"Comedy,Informative",The Tumblr-4chan Wars,12196602
HiTqIyx6tBU,Internet Historian,"Comedy,Informative",Any Poll's a Goal,12775556
fp2EZbbuMa0,Internet Historian,"Comedy,Informative",Pool's Closed,12865030
_p4h3jwJob0,Internet Historian,"Comedy,Informative",The Triggering of Shia | He Will Not Divide Us,11991068
vw9zyxm860Q,Internet Historian,"Comedy,Informative",Capture the Flag | He Will Not Divide Us,10954214
2rRIqrWuYy4,Internet Historian,"Comedy,Informative",Tales From TheVarus,11490237
HsLup7yy-6I,Internet Historian,"Comedy,Informative",Tay A.I. | The People's Chatbot,9184129
P1FUMdHU29c,Internet Historian,"Comedy,Informative",TheVarus Strakes Buck,10489921
t95aLo7R1NM,Internet Historian,"Comedy,Informative",The Harry Potter Skirmishes,9445140
YcuofODMCMU,Internet Historian,"Comedy,Informative",The Curse of the Olympic Flame,8488190
3aZuj_SDqDo,Internet Historian,"Comedy,Informative",Liverpool's Closed | He Will Not Divide Us,8323373
nzFykQv6Q08,Internet Historian,"Comedy,Informative",9gag's Meme Rock | #SmashTheStone,8288102
9XN57BhyZwk,Internet Historian,"Comedy,Informative",The Instagrabbing of /r/dankmemes,8430988
vZlmUG00OrI,Internet Historian,"Comedy,Informative",Brad's Wife,8598290
QWhUvm8SunY,Internet Historian,"Comedy,Informative",Balloon Boy | The Untold Story,7700075
h-StyszRCzc,Internet Historian,"Comedy,Informative",The Y2K Apocalypse,7303192
vvXRcwcIJh4,Internet Historian,"Comedy,Informative",Leeroy Jenkins | The Man Behind The Meme,7045571
-wmfpoq_Y0E,Internet Historian,"Comedy,Informative",Friendship Ended.,7189174
9NKG9lR34dM,Internet Historian,"Comedy,Informative",DUB the DEW | Mountain Dew Vs. The Internet,6836669
BJPc49z57bU,jacksepticeye,VideoGames,ALL THE WAY - Jacksepticeye Songify Remix by Schmoyoho,109291499
bqNzbkIHYF8,jacksepticeye,VideoGames,Five Nights At Freddy's 2 Animation | Jacksepticeye Animated,73785999
xqf7SfJUepE,jacksepticeye,VideoGames,Five Nights At Freddy's Animation | Jacksepticeye Animated,38062322
Uil9bh8kJgg,jacksepticeye,VideoGames,Five Nights At Freddy's 3 & 4 Animation | Jacksepticeye Animated,37605572
c3wKkZULCHg,jacksepticeye,VideoGames,YOU ARE WHAT YOU EAT! - The Visitor & The Visitor Returns,25601126
kD8f0ixy4u4,jacksepticeye,VideoGames,LOOK OUT BELOW! | Muddy Heights,23103759
zlGEsR1DQPw,jacksepticeye,VideoGames,THE BEST LAID PLANS | Fleeing The Complex,22603735
zNV2TOF2PC0,jacksepticeye,VideoGames,SHOW SOME MERCY | Undertale #1,23461477
jBZRZ9--rUs,jacksepticeye,VideoGames,Jacksepticeye Animated | Super Mario Maker,21582170
AtwgGc-An6U,jacksepticeye,VideoGames,DADDY'S HOME | God Of War - Part 1,25258282
yl3MiR7XXAM,jacksepticeye,VideoGames,Happy Wheels - Part 1 | THIS GAME IS MY BITCH,21541211
ugwwFmp4bIA,jacksepticeye,VideoGames,WUBBA LUBBA DUB DUB | Rick And Morty VR #1 (HTC Vive Virtual Reality),20393592
XU8_A4Kb2wo,jacksepticeye,VideoGames,Skate 3 - Part 16 | DOUBLE FLIP SUCCESS | Skate 3 Funny Moments,18414206
zFk_JjsTMKc,jacksepticeye,VideoGames,"OPERATE ON BILLY! | Tonsil, Ear and Heart Surgery",18158234
ficIQF23rqg,jacksepticeye,VideoGames,GIRLFRIEND REVENGE! | Whack Your Ex,18453719
rJmsCDWKCnc,jacksepticeye,VideoGames,Grand Theft Auto V | FUN WITH MOON GRAVITY | MAKING CARS FLY!,17339587
uQJ7Map2qwM,jacksepticeye,VideoGames,Jacksepticeye Reacts To Adults React To Jacksepticeye,17251421
B6KkwjGecmo,jacksepticeye,VideoGames,"Jacksepticeye Animated | DETAINED! (Papers,Please)",17579808
5ZYw4MIUgk0,jacksepticeye,VideoGames,Jacksepticeye Animated | JACK GOES TO SPACE!,17130339
Q9BVIwyUr9k,jacksepticeye,VideoGames,WE MAKE A GREAT TEAM | GTA Online #1 (GTA V Next Gen),17223346
ANQcBnQSQOU,jacksepticeye,VideoGames,TRY TO STOP! | Happy Wheels - Part 89,17244128
lBMAdwBLYgs,jacksepticeye,VideoGames,BECOME THE ULTIMATE DOUCHE | Douchebag Workout 2,17002224
z8XF2TByVbI,jacksepticeye,VideoGames,THE START OF SOMETHING AWESOME | Detroit:Become Human - Part 1,19488365
eEBXYh_ND-E,jacksepticeye,VideoGames,LORD OF DOUCHE | Douchebag Beach Club,16911925
JSOcG2Svf4U,jacksepticeye,VideoGames,Skate 3 - Part 1 | MOST HILARIOUS GAME EVER!,16659207
OnnxKjvAYLs,jacksepticeye,VideoGames,OPEN YOUR HEART TO ME | Heart and Knee Surgery,16350699
z1c0w5cYm18,jacksepticeye,VideoGames,"GET IN LINE! | Papers, Please #1",17022533
2JyUD79ky8s,jacksepticeye,VideoGames,VIRTUAL REALITY MCDONALDS | Job Simulator #1 (HTC Vive Virtual Reality),16732920
8qLIEjsBUF4,jacksepticeye,VideoGames,Five Nights At Freddy's Sister Location Animation | Jacksepticeye Animated,16438673
Mwt35SEeR9w,JCS - Criminal Psychology,Informative,What pretending to be crazy looks like,65505977
UQt46gvYO40,JCS - Criminal Psychology,Informative,Jennifer's Solution,42717874
eJt_afGN3IQ,JCS - Criminal Psychology,Informative,There's Something About Casey...,30244574
BemHqUqcpI8,JCS - Criminal Psychology,Informative,Guilty until proven innocent.,21229533
9x2NaGkl6BI,JCS - Criminal Psychology,Informative,"The Legend of ""Jeff""",19028988
WLSNPkf8RCU,JCS - Criminal Psychology,Informative,The Interrogation of Stephanie Lazarus,18962044
L0H6xYwMQnk,JCS - Criminal Psychology,Informative,The Case of Lee Rodarte,19174083
Xfg861hO-Ag,JCS - Criminal Psychology,Informative,The Case of Chris Watts - pt. 1,15399136
sVF_SlzxBJ4,JCS - Criminal Psychology,Informative,The Case of Michael Dunn,15249240
1J2YOLQM2Yc,JCS - Criminal Psychology,Informative,The Case of Michael Rafferty,14685294
sv0iN5J-9mk,JCS - Criminal Psychology,Informative,The Case of Michael Drejka,12482837
nVZhV7M3mNE,JCS - Criminal Psychology,Informative,The Case of Chris Watts - Part 2 - The Polygraph,10591897
bdUVehx6UBU,Joma in NYC,Blog,"My NYC Apartment tour | $3,000/month for 1 bedroom",2969023
WTxTBFU7Sdk,Joma in NYC,Blog,me trying to flirt with my best friend for 12 minutes straight,2569006
pYy5-KowMj0,Joma in NYC,Blog,me trying to flirt with my crush for 12 minutes straight,2200266
VnIsuYVlSls,Joma in NYC,Blog,why I moved to new york city,626413
gtXpRZUAc1o,Joma in NYC,Blog,first time leaving my apartment to go outside in NYC!,477898
pF2mNC4EXfA,Joma in NYC,Blog,a productive weekend in my life (cooking + writing),374915
MGGhz29kYYA,Joma in NYC,Blog,what I eat in a day | living alone in nyc,348528
015wj1C5wK0,Joma in NYC,Blog,"this video cost me $30,000 to make 😭",317528
C0f2pu0EVSg,Joma in NYC,Blog,I spent $5000 on custom mechanical keyboards,291734
l0IefQRFVfE,Joma in NYC,Blog,a weekend in my life in nyc | trying to become a filmmaker,287877
3kJPxsELVAk,Joma in NYC,Blog,me trying to flirt with my gym partner for 12 minutes straight,518323
qNxQRgsF2NA,Joma in NYC,Blog,i went to Hawaii | 100k subscribers thank you | imposter syndrome,158184
Rgx8dpiPwpA,Joma Tech,Blog,a day in the life of an engineer working from home,20304723
pKO9UjSeLew,Joma Tech,"Tech,Comedy",If Programming Was An Anime,10613346
vT3GUKuAzIs,Joma Tech,"Tech,Comedy",how coronavirus affects programmers in big tech companies,5291172
sW9npZVpiMI,Joma Tech,"Tech,Comedy",why you NEED math for programming,8564740
lpcpsCY4Mco,Joma Tech,"Tech,Comedy",how programmers attend meetings at big tech companies,5741782
EiKK04Ht8QI,Joma Tech,"Tech,Comedy",Don't Be A Programmer,3240188
OTfp2_SwxHk,Joma Tech,"Tech,Comedy",If Programming Was An Anime Part 2,4597929
HTXTVfBCeSY,Joma Tech,"Tech,Comedy",I Got Rejected By A 22-Year Old CEO,3939702
-UdWguw90g4,Joma Tech,"Tech,Comedy","I Built a Trading Bot to let Subscribers Trade $25,000 on Twitch",4232728
0KmUoTfGa34,Joma Tech,"Tech,Comedy",Coding a whole web app ONLY using my Phone.,3841449
xC-c7E5PK0Y,Joma Tech,"Tech,Comedy",What REALLY is Data Science? Told by a Data Scientist,3732569
0oBi8OmjLIg,Joma Tech,"Tech,Comedy",My Ultimate Work From Home Desk Setup for Productivity,3479081
uHt01D6rOLI,Joma Tech,"Tech,Comedy",If American Psycho were about Programmers,4734710
hWFDujYzvbI,Joma Tech,"Tech,Comedy",A Day In The Life Of Silicon Valley Engineers,2545560
X34ZmkeZDos,Joma Tech,"Tech,Comedy",Why Microsoft Word is the best IDE for programming,3669199
K7s1IYVfvSA,Joma Tech,Blog,How I Spend My $250K Software Engineer Income,3035491
Hv6EMd8dlQk,Joma Tech,"Tech,Comedy",if Apple made Window Blinds,5772191
1fPWr0d5zBE,Joma Tech,"Tech,Comedy",10 years of coding in 13 minutes,4807473
kZC12U6EhTc,Joma Tech,"Tech,Comedy",Ex Facebook Engineer Starts His First Startup Vlog,2175508
Ck0ozfJV9-g,Joma Tech,"Tech,Comedy",A Day In The Life Of A Data Scientist,2099098
fB7nyxXaczY,Joma Tech,Blog,Interview With My Brother Who Sold His Startup For $60 Million | Machine Learning Engineer,2085571
pvimAM_SLic,Joma Tech,"Tech,Comedy",Can you solve my favorite interview question? (math + cs),1704531
gvAF9mboxFM,Joma Tech,"Tech,Comedy",I got rejected by Amazon (Interview Fail),1680967
M5v1nXiUaOI,Joma Tech,"Tech,Comedy",Why I left my Data Science Job at FANG (Facebook Amazon Netflix Google),1396078
TLysAkFM4cA,Joma Tech,"Tech,Comedy",a day in the life of a startup engineer working from home,3105175
Pb3AAfz5Yjg,Joma Tech,"Tech,Comedy",Top 3 Programming Languages to Learn in 2019,1201735
uxRf7KS3abo,Joma Tech,"Tech,Comedy",i finally got a software engineering job,1045392
4FMdbwDdHlw,Joma Tech,"Tech,Comedy",Software Engineering Q&A While Cooking! (ft. Mayuko!),988891
cZFhjMQrVts,JRE Clips,Blog,How Serious is the Coronavirus? Infectious Disease Expert Michael Osterholm Explains | Joe Rogan,22595883
VFns39RXPrU,JRE Clips,Blog,Edward Snowden: How Your Cell Phone Spies on You,17815512
9ugC3TXSKoE,JRE Clips,Blog,Could You Make Tropic Thunder Today? w/Robert Downey Jr. | Joe Rogan,13172544
kJcpTSNWXdQ,JRE Clips,Blog,Joe Rogan & Bill Burr on Unattainable Beauty Standard Outrage,12653278
mwahLAUzf1s,JRE Clips,Blog,Herb Dean on What Khabib Says During His Fights | Joe Rogan,11367906
Cn1MugPalaA,JRE Clips,Blog,Joe Rogan | The Amazon is a Colossal Mystery w/Graham Hancock,14673295
0sr1Xeocuuc,JRE Clips,Blog,Physicist Brian Cox Explains Black Holes in Plain English | Joe Rogan,11444535
Ni5tgO4Bh3Y,JRE Clips,Blog,Joe Rogan | The Crazy Stuff They're Finding in the Amazon!!,10945658
CO5E-VoR3sA,JRE Clips,Blog,Joe Rogan on Uncontacted Tribes,12960376
7mmlmxamw_k,JRE Clips,Blog,Joe Rogan on Why he changed his stance on the Moon landing conspiracy,10549969
eWISIF0k8Mc,JRE Clips,Blog,"Joe Rogan Was Contacted by Scientology, Reads Their Statement",10145153
XolBNaavdAQ,JRE Clips,Blog,Joe Rogan Reacts to Mike Tyson’s Return to Boxing,8724228
8kJacGNg_9w,JRE Clips,Blog,Kevin Hart: Dave Chappelle is the GOAT !,12448321
UA3jI71gy8E,JRE Clips,Blog,Dr. Phil on the Catch Me Outside Girl | Joe Rogan,9342612
-xfra2_tVF8,JRE Clips,Blog,They Call These Chimps Lion Killers | Joe Rogan and Forrest Galante,9597093
tqqiZdqBNI0,JRE Clips,Blog,Joe Rogan | JFK Warned Us About Secret Societies,8493032
FozCkl1xj-w,JRE Clips,Blog,Former CIA Agent Breaks Down Jeffrey Epstein Case,12832013
dAfdPFWiF9U,JRE Clips,Blog,Leah Remini on Finding Out About Xenu (from Joe Rogan Experience #908),9571130
WqBZVlgORbY,Key & Peele,Blog,Key & Peele - Pawn Shop,32202162
izh-j8KUYjs,Key & Peele,Comedy,Key & Peele - Awesome Hitler Story,30646152
5Kod1q39ddE,Key & Peele,Comedy,Key & Peele - Dubstep,23910070
-qv7k2_lc0M,Key & Peele,Comedy,Key & Peele - Obama's Anger Translator - Meet Luther - Uncensored,23634681
UCW_UH-k-ec,Key & Peele,Comedy,Key & Peele - Party Games,23418883
j-2ZxldMO-M,Key & Peele,Comedy,If Hogwarts Were an Inner-City School - Key & Peele,26967888
07mBfR8erMY,Key & Peele,Comedy,Key & Peele - Fútbol Flop,21099780
YrpoK7Askck,Key & Peele,Comedy,Key & Peele - Ultimate C**k Blocker,20629145
leL_bsHEZdM,Key & Peele,Comedy,Key & Peele - Gangsta Standoff,20570932
rxhKrtb3XsE,Key & Peele,Comedy,The Saddest Sibling Rivalry of All Time - Key & Peele,22713143
nlD9JYP8u5E,Key & Peele,Comedy,Key & Peele - You Can Do Anything,19108064
IkTZ8BVAlFE,Key & Peele,Comedy,Key & Peele - Karim and Jahar,18952229
TLnUJzueBOQ,Key & Peele,Comedy,Is This Country Song Racist? - Key & Peele,25523795
SxwMTAy1gP0,Key & Peele,Comedy,Key & Peele - Baby Forest,19858754
IHfiMoJUDVQ,Key & Peele,Comedy,Key & Peele - Al Qaeda Meeting,18342728
9-GRzu6zbS0,Key & Peele,Comedy,Town Hall Audience Member - Key & Peele,23077348
vBzPsY3D58k,Key & Peele,Comedy,Key & Peele - Fraternity Branding,17450239
ZgyU0LyWZ9M,Key & Peele,Comedy,You Can’t Con a Con Artist If You’re Also a Con Artist - Key & Peele,19799214
7uG9PGqaWeo,Key & Peele,Comedy,Key & Peele - Pegasus Sighting,16921212
NQNAdgo91JE,Key & Peele,Comedy,The Most Gullible Prison Guard Ever - Key & Peele,18272616
ztRSm_SJP58,Key & Peele,Comedy,Key & Peele - Hoodie,16101442
vNIe_UwHPU0,Key & Peele,Comedy,Key & Peele - Video Game Sensors,16319239
5pKt4gaErvU,Key & Peele,Comedy,Dueling Hats - Key & Peele,19386073
0z-oJTZ1b5Q,Key & Peele,Comedy,Ultimate Fighting Goes to the Next Level - Key & Peele,17196716
bxHEZU0AFcQ,Key & Peele,Comedy,Key & Peele - Roommate Meeting,14131016
__d2FMCtgi4,Key & Peele,Comedy,Key & Peele - Les Mis,14593604
ir_OzWzbnC0,Key & Peele,Comedy,What Catcalling Was Like in the Olden Days - Key & Peele,15304898
ntfProwNYkE,Key & Peele,Comedy,Key & Peele - Movie Hecklers,14076144
_uScCrpAW4U,Key & Peele,Comedy,Key & Peele - Slow Brotion,13492175
3-jv7doUI8o,Key & Peele,Comedy,Key & Peele - Strike Force Eagle 3: The Reckoning - Uncensored,13876295
BtN-goy9VOY,Kurzgesagt – In a Nutshell,Comedy,The Coronavirus Explained & What You Should Do,88658704
zQGOcOUBi6s,Kurzgesagt – In a Nutshell,Science,The Immune System Explained I – Bacteria Infection,53784111
9tbxDgcv74c,Kurzgesagt – In a Nutshell,Science,What If You Detonated a Nuclear Bomb In The Marianas Trench? (Science not Fantasy),33879314
YI3tsmFsrOg,Kurzgesagt – In a Nutshell,Science,The Deadliest Being on Planet Earth – The Bacteriophage,33088904
jAhjPd4uNFY,Kurzgesagt – In a Nutshell,Science,Genetic Engineering Will Change Everything Forever – CRISPR,29520125
3mnSDifDSxQ,Kurzgesagt – In a Nutshell,Science,The Largest Star in the Universe – Size Comparison,33086629
yWO-cvGETRQ,Kurzgesagt – In a Nutshell,Science,Why Black Holes Could Delete The Universe – The Information Paradox,29597461
JyECrGp-Sw8,Kurzgesagt – In a Nutshell,Science,What If We Detonated All Nuclear Bombs at Once?,31296766
h6fcK_fRYaI,Kurzgesagt – In a Nutshell,Science,The Egg - A Short Story,31381601
ulCdoCfw-bY,Kurzgesagt – In a Nutshell,Science,The Black Hole Bomb and Black Hole Civilizations,28245558
UjtOGPJ0URM,Kurzgesagt – In a Nutshell,Science,Why Alien Life Would be our Doom - The Great Filter,26684434
4_aOIA-vyBo,Kurzgesagt – In a Nutshell,Science,Three Ways to Destroy the Universe,27193752
n3Xv_g3g-mA,Kurzgesagt – In a Nutshell,Science,Loneliness,26324481
Da-2h2B4faU,Kurzgesagt – In a Nutshell,Science,String Theory Explained – What is The True Nature of Reality?,24022778
5iPH-br_eJQ,Kurzgesagt – In a Nutshell,Science,What if We Nuke a City?,28229852
9P6rdqiybaw,Kurzgesagt – In a Nutshell,Science,Wormholes Explained – Breaking Spacetime,24033986
e-P5IFTqB98,Kurzgesagt – In a Nutshell,Science,Black Holes Explained – From Birth to Death,23865559
1AElONvi9WQ,Kurzgesagt – In a Nutshell,Science,Why Blue Whales Don't Get Cancer - Peto's Paradox,26060320
dGiQaabX3_o,Kurzgesagt – In a Nutshell,Science,What Happened Before History? Human Origins,22168421
pP44EPBMb8A,Kurzgesagt – In a Nutshell,Science,How to Build a Dyson Sphere - The Ultimate Megastructure,22387876
PaErPyEnDvk,Kurzgesagt – In a Nutshell,Science,What’s Hiding at the Most Solitary Place on Earth? The Deep Sea,22673022
tlTKTTt47WE,Kurzgesagt – In a Nutshell,Science,Is Reality Real? The Simulation Argument,21111259
ZL4yYHdDSWs,Kurzgesagt – In a Nutshell,Science,How Far Can We Go? Limits of Humanity (Old Version – Watch the New One),18081434
p_8yK2kmxoo,Kurzgesagt – In a Nutshell,Science,The Most Dangerous Stuff in the Universe - Strange Stars Explained,21889434
1-NxodiGPCU,Kurzgesagt – In a Nutshell,Science,This Virus Shouldn't Exist (But it Does),22014930
7_e0CA_nhaE,Kurzgesagt – In a Nutshell,Science,The World War of the Ants – The Army Ant,24014126
uqKGREZs6-w,Kurzgesagt – In a Nutshell,Science,Building a Marsbase is a Horrible Idea: Let’s do it!,20395558
JhHMJCUmq28,Kurzgesagt – In a Nutshell,Science,Quantum Computers Explained – Limits of Human Technology,18495181
oakWgLqCwUc,Kurzgesagt – In a Nutshell,Science,Milk. White Poison or Healthy Drink?,20835450
I2O7blSSzpI,LEMMiNO,Science,Cicada 3301: An Internet Mystery,34439702
kd2KEHvK-q8,LEMMiNO,Informative,The Vanishing of Flight 370,26031004
