Id,Channel,Category,Title,View Count
OkmNXy7er84,3Blue1Brown,Science,The hardest problem on the hardest test,15518298
r6sGWTCMz2k,3Blue1Brown,Science,But what is a Fourier series? From heat flow to drawing with circles | DE4,17635533
bBC-nXj3Ng4,3Blue1Brown,Science,But how does bitcoin actually work?,15576961
aircAruvnKk,3Blue1Brown,Science,"But what is a neural network? | Chapter 1, Deep learning",16106471
HEfHFsfGXjs,3Blue1Brown,Science,The most unexpected answer to a counting puzzle,12655044
spUNpyF58BY,3Blue1Brown,Science,But what is the Fourier Transform? A visual introduction.,10074203
Kas0tIxDvrg,3Blue1Brown,Science,Exponential growth and epidemics,5955001
WUvTyaaNkzM,3Blue1Brown,Science,The essence of calculus,8822496
GNcFjFmqEc8,3Blue1Brown,Science,But why is a sphere's surface area four times its shadow?,7691004
fNk_zzaMoSs,3Blue1Brown,Science,"Vectors | Chapter 1, Essence of linear algebra",7972390
gxAaO2rsdIs,3Blue1Brown,Science,Simulating an epidemic,5146854
IHZwWFHWa-w,3Blue1Brown,Science,"Gradient descent, how neural networks learn | Chapter 2, Deep learning",6606160
d-o3eB9sfls,3Blue1Brown,Science,Why is pi here? And why is it squared? A geometric answer to the Basel problem,5913255
M64HUIJFTZM,3Blue1Brown,Science,"The unexpectedly hard windmill question (2011 IMO, Q2)",4867078
jsYwFizhncE,3Blue1Brown,Science,Why do colliding blocks compute pi?,6415473
EK32jo7i5LQ,3Blue1Brown,Science,"Why do prime numbers make these spirals? | Dirichlet’s theorem, pi approximations, and more",5464035
sD0NjbwqlYw,3Blue1Brown,Science,Visualizing the Riemann zeta function and analytic continuation,4576313
k7RM-ot2NWY,3Blue1Brown,Science,"Linear combinations, span, and basis vectors | Chapter 2, Essence of linear algebra",5096708
kYB8IZa5AuE,3Blue1Brown,Science,"Linear transformations and matrices | Chapter 3, Essence of linear algebra",4849709
XFDM1ip5HdU,3Blue1Brown,Science,What does it feel like to invent math?,4108961
CfW845LNObM,3Blue1Brown,Science,"The other way to visualize derivatives | Chapter 12, Essence of calculus",3529390
d4EgbgTm0Bg,3Blue1Brown,Science,Visualizing quaternions (4d numbers) with stereographic projection,4534660
QJYmyhnaaek,3Blue1Brown,Science,"All possible pythagorean triples, visualized",3832751
PFDu9oVAE-g,3Blue1Brown,Science,"Eigenvectors and eigenvalues | Chapter 14, Essence of linear algebra",4569752
gB9n2gHsHN4,3Blue1Brown,Science,Fractals are typically not self-similar,3886802
Ilg3gGewQ5U,3Blue1Brown,Science,"What is backpropagation really doing? | Chapter 3, Deep learning",4279581
rB83DpBJQsE,3Blue1Brown,Science,"Divergence and curl: The language of Maxwell's equations, fluid flow, and more",4078883
zwAD6dRSVyI,3Blue1Brown,Science,Thinking outside the 10-dimensional box,3025060
3d6DsjIBzJ4,3Blue1Brown,Science,"Taylor series | Chapter 11, Essence of calculus",3950548
p_di4Zn4wz4,3Blue1Brown,Science,"Differential equations, a tourist's guide | DE1",3913704
YiM9oosSvNg,A&E,News,"Live PD: Most Viewed Moments from Jeffersonville, Indiana Police Department | A&E",39066049
QgONIEV7Rh0,A&E,News,60 Days In: The Tater Tot Fight (Season 1 Flashback) | A&E,30517798
2Sj2fd6b_Cg,A&E,News,"Live PD: Most Viewed Moments from Richland County, South Carolina | A&E",33664865
HLedllETYD4,A&E,News,Live PD: Top 5 Busts | A&E,38841268
0viKv1RDhak,A&E,News,Court Cam: Russian Man Tries to Escape from Court (Season 2) | A&E,29536441
ii50SWTJSoA,A&E,News,Court Cam: Crowd Cheers for Wrongfully Convicted Man Found NOT Guilty (Season 1) | A&E,28703278
PIotJjzDyHM,A&E,News,Court Cam: Top 5 Most Disrespectful Defendants | A&E,31186977
Zn0GBm1ltIk,A&E,News,Live PD: Top 6 Most Unusual Calls | A&E,28830374
ce28TIoa4ao,A&E,News,Live PD: Top 4 Car Chases | A&E,27756865
-VRx0GRo-Ws,A&E,News,Court Cam: Judge Recognizes Friend from Middle School (Season 2) | A&E,25717880
fxk3ZTusSqI,A&E,News,"Live PD: Most Viewed Moments from East Providence, Rhode Island | A&E",24840010
nbBHdhFs1q0,A&E,News,"Live PD: Most Viewed Moments from Slidell, Louisiana Police Department | A&E",25765511
s4X-CSFTUfo,A&E,News,Live PD: Most Viewed Moments from Arizona/Phoenix Metro | A&E,24970211
iVv_xiIx22Q,A&E,News,"Live PD: Most Viewed Moments from Calvert County, MD | A&E",25474580
LqUxOfIdxxo,A&E,News,Live PD: Top 6 Worst Liars | A&E,26471969
VqP-2ftKIYI,A&E,News,60 Days In: The Pod Bully (Season 4 Flashback) | A&E,20007120
-9JQndAAvLE,A&E,News,Live PD: Most Viewed Moments from Utah Highway Patrol | A&E,23410524
fA5Z2e86Hns,A&E,News,Behind Bars: Rookie Year: Top 7 Prison Gang Moments | A&E,21230802
p6OkpHNtvE4,A&E,News,Watch This Cat RESCUE A CHILD From Dog Attack | An Animal Saved My Life | A&E #shorts,20846141
eoFgUT82pTc,A&E,News,Man RISKS HIS LIFE to Rescue Cat From 6th Floor Balcony | Neighborhood Wars | A&E #shorts,23007239
goxvS5pxLDo,A&E,News,Live PD: Most Viewed Moments from Florida Compilation | A&E,20629555
XAtzfJcuHjY,A&E,News,Live PD: Most Viewed Moments from 2019 | A&E,17855682
9ANWQPD4Ak0,A&E,News,"Live PD: Most Viewed Moments from of Nye County, NV | A&E",18883565
8NLE8d4GW-Y,A&E,News,"Live PD: Cop Calls w/ Jeffersonville, Indiana Police Department | A&E",19448918
LiEFyZGcK5c,A&E,News,"Live PD: Most Viewed Moments from Missoula County, Montana - Part 2 | A&E",19835654
ZLuxpDxhHYA,A&E,News,"Live PD: Most Viewed Moments from Lake County, Illinois Sheriff's Office (Part 1) | A&E",18612726
YiEj9mrqTN0,A&E,News,"Live PD: Most Viewed Moments from Walton County, FL | A&E",19010796
IF59QNrF1VQ,A&E,News,60 Days In: Top 5 Moments From Clark County Jail | A&E,20086489
-gal8E_dgE8,About To Eat,Food,Day In The Life of A Michelin Star Chef,11690480
29ZP8ADQJ1Y,About To Eat,Food,Day In The Life Of An Indian Master Chef,5819679
rRSOt9SpBMI,About To Eat,Food,$20 Whole Chicken Vs. $78 Whole Chicken,5657712
0U_Mpg59FSw,About To Eat,Food,Worth It: Japan Marathon,5679055
4G6Y6glM_hg,About To Eat,Food,I Only Made Korean Food For 24 Hours,3134692
pJbC7W2fMvQ,About To Eat,Food,I Tried $800 Sushi Takeout,2850917
eHSvv8eSsvc,About To Eat,Food,How I Cooked 25 Pounds Of Potatoes,3196843
CmI2dXo14sY,About To Eat,Food,$6 Sauce Vs. $185 Sauce,3197027
PlI3gjkcPz0,About To Eat,Food,I Only Made Indian Food For 24 Hours,2781296
Bhos_P4a-JQ,About To Eat,Food,$4 Dessert Vs. $235 Dessert,3261676
uJa584PPm-E,About To Eat,Food,Worth It: Taiwan Marathon,3391736
48DD3kekP3E,About To Eat,Food,How I Cooked 20 Pounds of Tomatoes,2282927
39opX6-QJJI,About To Eat,Food,I Only Ate Pixar Foods For 24 Hours,1649745
AAtoia2BbjE,About To Eat,Food,I Tried Making The Most Difficult Omurice (Again),1509092
wkPxBltQzzg,About To Eat,Food,I Tried $249 Korean BBQ Takeout,1280210
rA1Kjvxu28w,About To Eat,Food,Do I Need This $500 Kitchen Knife In My Life?,1656579
xlPJfeNzBzE,About To Eat,Food,3 Ways We Make A Whole Chicken,1280736
UT9a7EtxQOM,About To Eat,Food,How Rie and Alvin Make Egg Fried Rice At Home,1072991
h5st8mluVUo,About To Eat,Food,Using a $160 Cast Iron For 30 Days,1929841
Uk3-FxTF-BU,About To Eat,Food,I Made This 96-Hour Ox Tongue Stew From Worth It,1017667
LHx63zUMLpM,About To Eat,Food,Using A $329 Toaster For 30 Days,1065137
F3RGIBExjfE,About To Eat,Food,How I Cooked 200 Cloves of Garlic,1438617
uxhgrd6HWVw,About To Eat,Food,3 Ways We Use Cast Iron,996260
whJgPudKgE0,About To Eat,Food,I Recreated This Cheese-Crusted Burrito,910994
IsGWMxZhlOY,About To Eat,Food,4 Ways We Use Tofu,969511
iCd5Po4fPb0,About To Eat,Food,I Only Made Binging With Babish Food For 24 Hours,1194864
nUSI5uUocho,About To Eat,Food,I Made These Fries and Ketchup From Worth It,829875
0GCuvcTI090,Abroad in Japan,Blog,12 Things NOT to do in Japan,17540804
-tBy2jemw4s,Abroad in Japan,Blog,Japan's Biggest Gaming Obsession Explained | Pachinko,11894605
SkY1DiyCqTU,Abroad in Japan,Blog,How Expensive is it to Travel Japan? | Budget Travel Tips,7524076
U7Q3sKNuZA0,Abroad in Japan,Blog,Staying at a Tokyo Capsule Hotel,5857234
aVT0BvWZcLg,Abroad in Japan,Blog,Inside Japan's SLEEPER Train | $160 FIRST CLASS Room,6417755
icwENiwT1zI,Abroad in Japan,Blog,Inside Japan's Most Expensive Bullet Train | $750 Seat,6152960
3LS83dDqoGU,Abroad in Japan,Blog,Living in Japan: Culture Shock!,5691624
IXgX_r-x-XE,Abroad in Japan,Blog,INSIDE A JAPANESE LOVE HOTEL,5693282
fso4yjbgceY,Abroad in Japan,Blog,What Owning a Love Hotel in Japan is Like,5056090
qKFep4ekvx0,Abroad in Japan,Blog,Japan's Most Expensive Beef | Wagyu,4802013
5VmCvChcGzU,Abroad in Japan,Blog,Being Rudely Awoken by a North Korean Missile,4640152
nfpWAqK0YZE,Abroad in Japan,Blog,12 Reasons NOT to Move to Japan,6312689
fmOP68S5v7c,Abroad in Japan,Blog,How Difficult is Travelling Japan without Japanese? | Travel Tips,4931312
5VDnj8IEWNc,Abroad in Japan,Blog,What Teaching English in Japan was REALLY Like,4479940
_IOZbJ7PCPk,Abroad in Japan,Blog,Speaking Japanese Fluently in 6 Months | 6 Steps to Success,3963685
wwH3rA8Evow,Abroad in Japan,Blog,DON'T GET FAT IN JAPAN,3762876
HEaaln5jDl8,Abroad in Japan,Blog,I Spent a Week with Japan's Biggest Rock Star,3994102
faJM9iQZMbQ,Abroad in Japan,Blog,21 Things to do When You Arrive in Japan,3615625
mtnVU4BU39E,Abroad in Japan,Blog,Why I DON'T Watch JAPANESE TV,4372504
ueTa3dytTuY,Abroad in Japan,Blog,Visiting Japan: 5 Reasons Why It'll Be Awesome,3183050
u240yK8_fVM,Abroad in Japan,Blog,Staying at a Traditional Japanese Inn & Hot Spring | Ryokan,3033493
tORfGTrr1ww,Abroad in Japan,Blog,"What a $20,000/Month Japanese Apartment is Like | Tokyo Home Tour",3052654
tLExSqNNMPc,Abroad in Japan,Blog,What NO-ONE Tells You About Japan,3254970
l3ifRE7BQiM,Abroad in Japan,Blog,Japanese Nightlife Etiquette | Beginner's Travel Guide,2874977
TwPHIABVdg8,Abroad in Japan,Blog,Is this Japan's Most Mouthwatering Ramen?,2829685
yWwfNmIIc_Q,Abroad in Japan,Blog,Tokyo's Freshest Sushi | Tsukiji Fishmarket,2648206
AHuj4DCueO4,Abroad in Japan,Blog,6 Must Try Japanese Dishes in Tokyo | Tsukiji Street Food,3058606
RuAQo97K-zE,Abroad in Japan,Blog,26 Traits Japanese Girls Want in a Guy,2964555
M400lV0GNV4,Abroad in Japan,Blog,I Tried EVERY Japanese Fried Chicken | Ft. @CDawgVA,4510647
j5gy6QLq8wg,Abroad in Japan,Blog,6 Must Try Japanese Foods | Iwate,2566467
TjP0UgI8CTg,Austin Evans,Tech,BROKE vs PRO Gaming,26342247
7Fjn4GRw8qE,Austin Evans,Tech,"Xbox Series X Hands On, Gameplay & Controller!",16130277
HtJa9jJdzac,Austin Evans,Tech,Building the Ultimate PS4,12835679
KM0ZV1X9o7o,Austin Evans,Tech,Razer Just Made The Best Gaming Keyboard...,10621571
5pP8TLwO_Ks,Austin Evans,Tech,This Will Kill Your Computer,10334928
6ghOAKzQMGY,Austin Evans,Tech,Is a $100 Game Console Worth It?,8661686
G_ZxvxtUwus,Austin Evans,Tech,Building the Ultimate Nintendo Switch,8784522
KrMvtS7DAlM,Austin Evans,Tech,Building the Ultimate Xbox One,8251378
E9-x3jRSQvQ,Austin Evans,Tech,How to Build a Gaming PC in 2020,7981496
-naamtpQ8lw,Austin Evans,Tech,BROKE vs PRO Gaming Setup,8704670
5NX-U36VDis,Austin Evans,Tech,Building the Ultimate PS4 Pro,7373502
ObQhpDQzfXE,Austin Evans,Tech,Top 5 Gaming Life Hacks!,7039701
PGqZkOveLb8,Austin Evans,Tech,It's All Gone,7103080
Q1UXZs-yWDc,Austin Evans,Tech,How NOT to Buy a Gaming PC,6969585
_RKYQdUUttc,Austin Evans,Tech,Trying The Cheapest Keyboards on Amazon...,6259749
VmzQ2hdfQcs,Austin Evans,Tech,iPhone 6 vs Samsung Galaxy S5 Speed Test!,6055303
16q8_32M03k,Austin Evans,Tech,The Ultimate PlayStation Comparison,6263420
r-7UBVzjO8Y,Austin Evans,Tech,The Biggest vs Smallest Laptop?,5724828
0Xi2rurVAvs,Austin Evans,Tech,Can You Play Fortnite on a $200 Laptop?,5545908
4hCy4-G37jA,Austin Evans,Tech,How To Waste $1811.42...,5424256
N1uHX_WQsEY,Austin Evans,Tech,Use a Keyboard and Mouse on PS4 & Xbox One!,5218774
X3XkG6GL_DM,Austin Evans,Tech,$50 Gaming PC Challenge!,5237145
tXqQs7oMwmg,Austin Evans,Tech,Is PlayStation VR Worth It?,5365139
SzkHeDPTLOg,Austin Evans,Tech,I Wasted $200 on Wish...,5277662
FcX0pkXSKl4,Austin Evans,Tech,Building the Ultimate Xbox 360,5484567
0SmVHslppDQ,Austin Evans,Tech,Building the Portable PS4,4765424
s_Sf4wfwvzI,Austin Evans,Tech,Top 5 Worst Phones Ever!,4653920
Y80ZTbjtz5c,Austin Evans,Tech,Gaming Life Hacks,5587949
GpMP6Nh3FvU,Barely Sociable,Informative,The Dark Side Of The Silk Road,11890388
_28b0P_6VvY,Barely Sociable,Informative,The Mysterious Phone Number From The 90's,3752044
1ci3l7pnfdk,Barely Sociable,Informative,Mortis - Internet Mysteries,3615816
1VZkiQUzITU,Barely Sociable,Informative,Dream - The Infiltration Of The Dark Net,4238311
pl20NdwAs3k,Barely Sociable,Informative,The Mysterious Black Box Of Flight 980 - An Unsolved Mystery,3292151
eS_rEzKdzBA,Barely Sociable,Informative,"The Scientist That ""Discovered Antigravity"" Then Disappeared Completely - An Unsolved Mystery",3872073
NCPNTsKBZS0,Barely Sociable,Informative,What Is Going On With Room 322? - Reddit Mysteries,2527004
_OzpODjTISc,Barely Sociable,Informative,Exploring A Reddit Cult,2554462
7vQyrlW8ahw,Barely Sociable,Informative,A Redditor's Dark Confession,2329569
tF0dCNxfYHk,Barely Sociable,Informative,Lake City Quiet Pills Explained - Reddit Mysteries,3179677
9na8UBoncy4,Barely Sociable,Informative,Who Is Canada's Unidentified Maximum Security Prisoner?,2365463
q-1HikE4b54,Barely Sociable,Informative,"The Book Tied To 75,000 Disappearances",3836471
6PtiY-ev2qA,Barely Sociable,Informative,The Hospital Abandoned Without A Reason (Ft. ReignBot),1842884
snWvNkJCCs8,Barely Sociable,Informative,The SOS Sign Incident - An Unsolved Mystery,2441970
OA6F6liLnvc,Barely Sociable,Informative,Lets Not Meet Case File - Jacqueline Ades,1761341
_Kav2K1DVWo,Barely Sociable,Informative,The Most Elusive Identity On The Internet - Pt. 1 (Ft. Nexpo),1892506
1R97tphpD_M,Barely Sociable,Informative,The Most Corrupt Investigation In Aviation History - The Mysterious Fate Of Pan Am Flight 7,2929986
q9XmXad_wmo,Barely Sociable,Informative,What Was Neurocam? - Internet Mysteries,1752478
k_B3a2cCqo0,Barely Sociable,Informative,Redditor Under Surveillance,1473874
NMDZcbkgpJA,Barely Sociable,Informative,The Bizarre Disappearance Of A Canadian CEO - An Unsolved Mystery,1828448
KQMZexRllNs,Barely Sociable,Informative,How A Lost FBI Tape Surfaced On YouTube Ft. BlameItOnJorge,2139393
XfcvX0P1b5g,Barely Sociable,Informative,Bitcoin - Unmasking Satoshi Nakamoto,1419911
vboQOQwifwg,Barely Sociable,Informative,Solving The Internet's Oldest Mystery,1236424
xEeyLDTAkK8,Barely Sociable,Informative,The Fake Diploma Forum Spammer - Internet Oddities,924095
HnE60IVm51E,Barely Sociable,Informative,The Dark Web Saga Of Besa Mafia,1142892
fMWnaR5uJxQ,Barely Sociable,Informative,The Most Elusive Identity On The Internet - Pt. 2,929680
DBkONFkdWSM,Barely Sociable,Informative,The Cryptic Last Words Sent From A World Famous Yacht,1683727
CwwZFxH1W4c,Barely Sociable,Informative,What Is Really Going On With U.S. Army Esports?,610918
RwTAgom_VX8,BBC News,News,Mia Khalifa: Why I’m speaking out about the porn industry - BBC News,17551792
DDo4CA13LbY,BBC News,News,Jimmy Page: How Stairway to Heaven was written - BBC News,13813561
6VixqvOcK8E,BBC News,News,Ben Shapiro: US commentator clashes with BBC's Andrew Neil - BBC News,13206069
JqhCAORmsaE,BBC News,News,World's 'poorest president' Uruguay's Jose Mujica & his $1m VW,10930336
t17O2AKa2FU,BBC News,News,Australian man interrupts PM Morrison to say 'get off my lawn' - BBC News,12432880
LKXvdyNz6L8,BBC News,News,Mariana Trench: Record-breaking journey to the bottom of the ocean - BBC News,10532986
qWAagS_MANg,Bon Appétit,Food,Every Way to Cook an Egg (59 Methods) | Bon Appétit,38961293
WrOzwoMKzH4,Bon Appétit,Food,How To Butcher An Entire Cow: Every Cut Of Meat Explained | Bon Appetit,15119173
TudhYwBrgYg,Bon Appétit,Food,Pastry Chef Attempts To Make Gourmet Skittles | Gourmet Makes | Bon Appétit,13306589
1Gdl-A1DvpA,Bon Appétit,Food,Gordon Ramsay Challenges Amateur Cook to Keep Up with Him | Back-to-Back Chef | Bon Appetit,12560738
VyaxDWLe6A4,Bon Appétit,Food,Every Way to Cook a Chicken Breast (32 Methods) | Bon Appétit,12286047
g1GFJxVeH9c,Bon Appétit,Food,Pastry Chef Attempts to Make Gourmet Instant Ramen | Gourmet Makes | Bon Appétit,12079067
XY-hOqcPGCY,Bon Appétit,Food,Pastry Chef Attempts to Make Gourmet Ferrero Rocher | Gourmet Makes | Bon Appétit,12477616
Ew-3-8itpjc,Bon Appétit,Food,How to Make 29 Handmade Pasta Shapes With 4 Types of Dough | Handcrafted | Bon Appétit,12525218
2J6bJnwr1rw,Bon Appétit,Food,Binging with Babish Reviews The Internet's Most Popular Food Videos | Bon Appétit,10831335
-pAOuR8s03Q,Bon Appétit,Food,Pastry Chef Attempts To Make Gourmet Oreos | Gourmet Makes | Bon Appétit,10802948
4nqJiBRNQuw,Bon Appétit,Food,Pastry Chef Attempts To Make Gourmet Kit Kats | Gourmet Makes | Bon Appétit,10592704
RrkL9e2w7gQ,Bon Appétit,Food,Pastry Chef Attempts to Make Gourmet Doritos | Gourmet Makes | Bon Appétit,11031042
oidnwPIeqsI,Bon Appétit,Food,Brad and Claire Make Sourdough Bread | It's Alive | Bon Appétit,10256239
hc3TEaT3WHA,Bon Appétit,Food,Every Way to Cook a Potato (63 Methods) | Bon Appétit,10960274
LrRzZXuE9qA,Bon Appétit,Food,Pastry Chef Attempts to Make Gourmet Takis | Gourmet Makes | Bon Appétit,10204057
_r9Ndb6N_y0,Bon Appétit,Food,How To Butcher a Whole Tuna: Every Cut of Fish Explained | Handcrafted | Bon Appétit,10505460
xmRaWhae5e8,Bon Appétit,Food,Pastry Chef Attempts to Make Gourmet Starburst | Gourmet Makes | Bon Appétit,10116632
HzUIUTatyZI,Bon Appétit,Food,Pastry Chef Attempts to Make Gourmet Krispy Kreme Doughnuts | Gourmet Makes | Bon Appétit,10726116
Jpd_CUX2o98,Bon Appétit,Food,Every Way to Cook a Steak (43 Methods) | Bon Appétit,9878182
u6TFP_r2oA8,Bon Appétit,Food,Working 24 Hours Straight at Chick-fil-A | Bon Appetit,9088128
UPS4nxI0b9g,Bon Appétit,Food,Pastry Chef Attempts To Make Gourmet Lucky Charms | Gourmet Makes | Bon Appétit,8870310
J3xLG-whfFk,Bon Appétit,Food,Pastry Chef Attempts to Make Gourmet Pringles | Gourmet Makes | Bon Appétit,8845022
SGNwG_MjslI,Bon Appétit,Food,Pastry Chef Attempts to Make Gourmet Reese's Peanut Butter Cups | Gourmet Makes | Bon Appétit,8919084
H2nY7Tu1Qgs,Bon Appétit,Food,Pastry Chef Attempts To Make Gourmet Cheetos | Bon Appétit,8635601
BriBDiBxaMY,Bon Appétit,Food,Pastry Chef Attempts to Make Gourmet Hot Pockets | Gourmet Makes | Bon Appétit,9176258
qOsp6IMqnn0,Bon Appétit,Food,Pastry Chef Attempts to Make Gourmet Twix | Gourmet Makes | Bon Appétit,8710269
fEMxFSjmo5Q,Bon Appétit,Food,Pastry Chef Attempts To Make Gourmet Gushers | Bon Appétit,8095989
IeM8OReKzfQ,Bon Appétit,Food,Pastry Chef Attempts to Make Gourmet Snickers | Gourmet Makes | Bon Appétit,8032268
fuOnYDEIjUA,Bon Appétit,Food,Pastry Chef Attempts To Make Gourmet Twizzlers | Gourmet Makes | Bon Appétit,7548325
ppi0khS0s_8,Bon Appétit,Food,Pastry Chef Attempts to Make Gourmet Sour Patch Kids | Gourmet Makes | Bon Appétit,7718220
HlBYdiXdUa8,Brooklyn Nine-Nine,"Comedy,Entertainment",I Want It That Way | Brooklyn Nine-Nine,38954764
Cr8N3xwvonY,Brooklyn Nine-Nine,"Comedy,Entertainment",Best of Rosa | Brooklyn Nine-Nine,7235354
Uhhw6Jw295o,Brooklyn Nine-Nine,"Comedy,Entertainment",Best of Caleb the Cannibal | Brooklyn Nine-Nine,8963460
ygPBddnvhwY,Brooklyn Nine-Nine,"Comedy,Entertainment",Best of Jake Peralta | Brooklyn Nine-Nine,6549923
ppxNZX4MDd8,Brooklyn Nine-Nine,"Comedy,Entertainment",This B needs a C in her A | Brooklyn Nine-Nine,6171493
X-Wmy_L5o9w,Brooklyn Nine-Nine,"Comedy,Entertainment",More Cold Opens | Brooklyn Nine-Nine,5387792
HhrbbYD5ScI,Brooklyn Nine-Nine,"Comedy,Entertainment",The Confession | Brooklyn Nine-Nine,4683523
SQUNZTdwGoc,Brooklyn Nine-Nine,"Comedy,Entertainment",Best of Hitchcock and Scully | Brooklyn Nine-Nine,4673046
6Ock5HVWPlk,Brooklyn Nine-Nine,"Comedy,Entertainment",Every Title Of Your Sex Tape | Brooklyn Nine-Nine,4021736
-378LN_fUqE,Brooklyn Nine-Nine,"Comedy,Entertainment",Charles Boyle The Ultimate Peraltiago Fan Girl Moments | Brooklyn Nine-Nine,4309991
NHQKH-nc8JY,Brooklyn Nine-Nine,"Comedy,Entertainment",The Best Of Gina | Brooklyn Nine-Nine,4339442
5WL8Omm7b-4,Brooklyn Nine-Nine,"Comedy,Entertainment",Captain Holt An Emotional Rollercoaster | Brooklyn Nine-Nine,4049079
fVt1fWsM73k,Brooklyn Nine-Nine,"Comedy,Entertainment",Screaming and Smash Cuts: Even More Cold Opens | Brooklyn Nine-Nine,3609664
529h0a2RMt4,Brooklyn Nine-Nine,"Comedy,Entertainment",Jake & Amy Feels (Vol 1) | Brooklyn Nine-Nine,3818414
cn1kw3_mI70,Brooklyn Nine-Nine,"Comedy,Entertainment",The Best Of Amy Santiago | Brooklyn Nine-Nine,3574693
-6Up7CG5d6M,Brooklyn Nine-Nine,"Comedy,Entertainment",Introducing The Squad | Brooklyn Nine-Nine,4158172
Cvo1sjervSU,Brooklyn Nine-Nine,"Comedy,Entertainment",Keep It In Your Pants Santiago | Brooklyn Nine-Nine,3561283
yPr9Xb_oRXk,Brooklyn Nine-Nine,"Comedy,Entertainment",Best Burns | Brooklyn Nine-Nine,3735043
TPLnnSHSeLE,Brooklyn Nine-Nine,"Comedy,Entertainment",Captain Holt Father Figure | Brooklyn Nine-Nine,3546340
Nb7WLJrW_PU,Brooklyn Nine-Nine,"Comedy,Entertainment",Captain Holt's Halloween Heist | Brooklyn Nine-Nine,3707381
sxpxDdLFSBo,Brooklyn Nine-Nine,"Comedy,Entertainment",Rosa's Mysterious Past | Brooklyn Nine-Nine,3802575
O9gg0pz7rlc,Brooklyn Nine-Nine,"Comedy,Entertainment",Cold Opens | Brooklyn Nine-Nine,3073661
8pD7MXQfdqU,Brooklyn Nine-Nine,"Comedy,Entertainment",Rosa Is Wearing Pink | Brooklyn Nine-Nine,3541520
S5HHOjOmWag,Brooklyn Nine-Nine,"Comedy,Entertainment",Best of Pimento | Brooklyn Nine-Nine,4108044
rRgQ067tyNg,Brooklyn Nine-Nine,"Comedy,Entertainment",Gina’s Crush On Terry | Brooklyn Nine-Nine,3964571
7XoGwFNUwiM,Brooklyn Nine-Nine,"Comedy,Entertainment",Amy Santiago Nerd Moments | Brooklyn Nine-Nine,3743421
nS7xHq3LNfU,Brooklyn Nine-Nine,"Comedy,Entertainment",Jake and Holt in Quarantine | Brooklyn Nine-Nine,3044609
I6Oku6zex-k,Brooklyn Nine-Nine,"Comedy,Entertainment",What Happened When Jake Was Away | Brooklyn Nine-Nine,3207747
RKpvSSzdRCg,Brooklyn Nine-Nine,"Comedy,Entertainment",Sassy Holt | Brooklyn Nine-Nine,3122926
nb-xbTV-22A,Brooklyn Nine-Nine,"Comedy,Entertainment",What The Hell Happened To Hitchcock and Scully? | Brooklyn Nine-Nine,3592087
ct-CdyT4HkM,BuzzFeedVideo,Entertainment,If Disney Princes Were Real,77316749
pWUzkxtoJ2I,BuzzFeedVideo,Entertainment,$1 Street Food Around The World,66951856
43uTBB574g4,BuzzFeedVideo,Entertainment,A Day In The Life Of A Pornstar,53974968
VzHtsoBwBqI,BuzzFeedVideo,Entertainment,Men Watch Porn With Porn Stars,42445703
A1LUHmUcIsk,BuzzFeedVideo,Entertainment,The Only Bra Hack Men Will Ever Need,47430805
Z5FoX3ju2J0,BuzzFeedVideo,Entertainment,$11 Steak Vs. $306 Steak,42222501
M6XiFKB7j0w,BuzzFeedVideo,Entertainment,$17 Fried Chicken Vs. $500 Fried Chicken,41795545
7fgCfC3bM0U,BuzzFeedVideo,Entertainment,The Try Guys Try Drag For The First Time,38160404
L6EwZWWRA-U,BuzzFeedVideo,Entertainment,People Who Hate Cats Meet Kittens,38622149
GTXP2FzQS94,BuzzFeedVideo,Entertainment,$24 Korean BBQ Vs. $346 Korean BBQ,38283808
n4bucphC9r4,BuzzFeedVideo,Entertainment,"$27 Cake Vs. $1,120 Cake",37134808
NHiqsrYkcuk,BuzzFeedVideo,Entertainment,$8 Pasta Vs. $100 Pasta,37403842
b81Cr97ANrk,BuzzFeedVideo,Entertainment,The Try Guys Try Labor Pain Simulation • Motherhood: Part 4,35912486
3tvegr-O9vI,BuzzFeedVideo,Entertainment,The Try Guys Try Pregnancy Bellies • Motherhood: Part 1,33784686
2GZrPR5Ajrs,BuzzFeedVideo,Entertainment,$3 Sushi Vs. $250 Sushi,33295604
G4Sn91t1V4g,BuzzFeedVideo,Entertainment,Dear Kitten,32860185
wduZHtRbSkY,BuzzFeedVideo,Entertainment,$4 Burger Vs. $777 Burger,33005861
6R8n6FbXVc8,BuzzFeedVideo,Entertainment,$2 Hot Dog Vs. $169 Hot Dog,33735099
RYuipbRGu5s,BuzzFeedVideo,Entertainment,My Gender Transition From Female To Male • Dear BuzzFeed,31809169
slmYnJdDQ1U,BuzzFeedVideo,Entertainment,What Do Boyfriends Want Their Girlfriends’ Makeup To Be?,31658413
QtVL76gh09U,BuzzFeedVideo,Entertainment,$3 Ramen Vs. $79 Ramen • Japan,33277684
bcdJgjNDsto,BuzzFeedVideo,Entertainment,"$2 Pizza Vs. $2,000 Pizza • New York City",31826835
vzSfnduxNDg,BuzzFeedVideo,Entertainment,$5 Pizza Vs. $135 Pizza,30989795
L3MtFGWRXAA,BuzzFeedVideo,Entertainment,Puppyhood,29993915
HuEREfPjT5Y,BuzzFeedVideo,Entertainment,Exes Kiss For The First Time Since Their Breakup,29210651
iN8zmmCRqUA,BuzzFeedVideo,Entertainment,$3 Fries Vs. $100 Fries,30511332
-XbX4eQlwgs,BuzzFeedVideo,Entertainment,Sex Before Vs. After Kids,29784006
V4Uuxg6jmbo,BuzzFeedVideo,Entertainment,The Try Guys Bake Bread Without A Recipe,29022631
KbgvSi35n6o,Captain Disillusion,Informative,Cicret Bracelet DEBUNK,11750479
5LI2nYhGhYM,Captain Disillusion,Informative,Laminar Flow DISAMBIGUATION,9767290
rsXQInxxzBU,Captain Disillusion,Informative,Superhuman Tape Measure Skills DEBUNK,8058579
eLAwG7CjF_k,Captain Disillusion,Informative,Escherian Stairwell Deconstruction,8667858
ou7KSmfC3lA,Captain Disillusion,Informative,Captain D's Definitive Guide to TRICK SHOTS,7376385
NXCtgI2lkFw,Captain Disillusion,Informative,Amazing Water Trick DEBUNK,6597678
W8sGTh7ZpoY,Captain Disillusion,Informative,Miss Ping Debunk,6194736
aO3JgPUJ6iQ,Captain Disillusion,Informative,Chinese Invisibility Cloak Hoax DESTROYED!!!,6523045
Cw7g8ixbomU,Captain Disillusion,Informative,Cicret Bracelet UPDATE,5555736
eKFrZNXB29M,Captain Disillusion,Informative,Invisible Box Challenge | Quick D,5421447
em-pVICrnqM,Captain Disillusion,Informative,Marble Sorting Machine DEBUNK,5206499
_dSp_f0f9gE,Captain Disillusion,Informative,The Magic of Will Tsai | Quick D,4879354
9vncG0IP9qU,Captain Disillusion,Informative,Wall Walking | Quick D,4492906
sWy1qmMoToM,Captain Disillusion,Informative,The Undebunkable,4440894
LuM1IXl66B8,Captain Disillusion,Informative,Gyro Drop | Quick D,4640172
uuhkVTJ6A_c,Captain Disillusion,Informative,UFO Over India DEBUNK,4089723
