Id,Channel,Category,Title,View Count
cdiFhv3gsyo,Screen Junkies,"Entertainment,Comedy",Honest Trailers - Suicide Squad,12497359
eUTtt14G31c,Screen Junkies,"Entertainment,Comedy",Honest Trailers - Avatar,12363117
5FWfg__wKSY,Screen Junkies,"Entertainment,Comedy",Honest Trailers - Skyfall,12317340
4iC9Qi3y9q8,SEA,Science,The Cosmic Scale,4983848
-ybiXR2WCFQ,SEA,Science,Journey to the Andromeda Galaxy [4K],5033807
W9ME-WBlkeM,SEA,Science,The Largest Star (Stephenson 2-18),3128136
0w4OTD4L0GQ,SEA,Science,The Great Attractor,2451431
XUtatDjX_i4,SEA,Science,Biggest Thing in the Universe: The Hercules-Corona Borealis Great Wall (Gamma Ray Burst Wall),1201216
ZVPsNDonA84,SEA,Science,The Other Side of a Black Hole,2201774
rJLtT0QXoPo,SEA,Science,When Black Holes Collide,1405821
xMy2O1RVkMI,SEA,Science,Large Quasar Groups,1233473
tIgL4h2S270,SEA,Science,Venus - Earth's Lost Twin,629385
aMoZbJ39rwg,Shroud,Science,PUBG IN VR!!!,16732365
LdZaqnAOthE,Shroud,VideoGames,SHROUD VS SILVER [MATCHMAKING],7417156
AhxpnCW1mp8,Shroud,VideoGames,SHROUD 1V1ING S1MPLE,6191027
WiUBM8bbDS4,Shroud,VideoGames,WHY I DONT PLAY PUBG MOBILE,5141476
IABIU27z7_k,Shroud,VideoGames,M24 MADNESS (FULL GAME),5641098
qQHWOA_ikHQ,Shroud,VideoGames,SHROUD VS HACKERS,4123678
JQ6TUnmaApY,Shroud,VideoGames,SHROUD THE KAR98 KING!,3738555
It0o9T5OS_4,Shroud,VideoGames,SHROUD INSANE 30 KILL GAME!,3570834
FljP5JViUOg,Shroud,VideoGames,SHROUD'S BEST EVER SNIPES,4144366
EsL5ajBEspE,Shroud,VideoGames,SHROUD'S BEST EVER FUNNY MOMENTS!,3674105
ADsp3UaLhl0,Shroud,VideoGames,the only game i'm bad at...,3217339
D8aQpYrfIBQ,Shroud,VideoGames,THE HACKERS IN PUBG,3202143
Xu1Qo-WFQFo,Shroud,VideoGames,HOW TO R-99,3201917
mE2mevd7-7A,Shroud,VideoGames,SHROUD VS VALORANT (JETT GAMEPLAY),3226065
xy1gghJRcfI,Shroud,VideoGames,CSGO VR!!,3101957
g8utYlNlb9A,Shroud,VideoGames,3 NUKES IN 17 MINUTES,2985266
1UFPWzVucSc,Shroud,VideoGames,MASSIVE APEX LEGENDS PACKS OPENING (200+ PACKS),2935543
F7Aqz3dAGfU,Shroud,VideoGames,"WE WON $100,000",2940695
7JBCHECtS58,Shroud,VideoGames,HILARIOUS GAME WITH DR DISRESPECT,2967092
glidaMrZrdY,Shroud,VideoGames,SHROUD'S BEST EVER 200IQ PLAYS,3029342
jG8Feqn6Z0E,Sky News,VideoGames,Israel Unrest: Hamas launches rocket attack on Tel Aviv,27238949
FnSr820S2Mk,Sky News,News,Explained: What happened in deadly Beirut explosion,21251278
_J60fQr0GWo,Sky News,News,The shocking centre of the COVID-19 crisis,12596926
N6cfFnBNELs,Sky News,News,Top Gear Presenter James May Reacts To Jeremy Clarkson Being Sacked By BBC,12838704
KH0SQbW-iaY,Sky News,News,Israel Air Raid Siren Sounds During Sky Broadcast,12323457
FH-_Mtkugbs,Sky News,News,Stuck at sea: Cargo ship wedged in Suez Canal causes traffic jam,11297860
jr9XRmWNpfw,Sky News,News,Hong Kong’s residents living in 'coffin' homes,14178642
J-LqLU7CxeA,Sky News,News,Builder Demolishes His Work After Pay Dispute With Homeowner,10091681
yGPfKkjDIts,Sky News,News,Trump v Biden: The Final Debate,10291865
Mf76yyTY7Ss,Sky News,News,Scrambling onto trucks for a better life,11143443
GESBI9pWWmI,Sky News,News,Harvey Weinstein: The fall of the king of Hollywood,7147900
9a0xIzp-fbs,Sky News,News,UFO: Pentagon releases three leaked videos - is the truth finally out there?,7796744
9E3FAKBlZh4,Sky News,News,Inside a captured Islamic State suicide vehicle,8040596
J1ugR-VVE1I,Sky News,News,Mosul's snatch squads,6797746
et8Cn9q_A-g,Sky News,News,Inside Mexico's Drug Labs | Narco State | Sky News,9196762
swoAnLQ38NI,Sky News,News,London terror: Police shoot dead terrorists within eight minutes,7301183
K8Z9Kqhrh5c,Sky News,News,Watch In Full: Trump versus Biden in the first US Presidential election debate,6864808
gW1CShFy0NI,Sky News,News,Tunisia Terror Attack: New Footage Of Rampage,5599170
wZsaXxtfuRg,Sky News,News,Man stabbed '18 times in 25 seconds' on train,7682200
A9tlDIhpMHo,Sky News,News,Exclusive: Inside an Islamic State Terror Weapons Lab,5368889
u8cg5hhHJlA,Sky News,News,Europe's Migration Tragedy: Life and death in the Mediterranean,7704298
hC4eog5cY9Q,Sky News,News,Exclusive: Video shows Harvey Weinstein behaving inappropriately,5556979
U4nBnuv9n9o,Sky News,News,Trump and Biden face off in final US presidential debate - highlights,5953014
kxLoycj4pJY,SmarterEveryDay,News,TATTOOING Close Up (in Slow Motion) - Smarter Every Day 122,86468524
QJ9lNRAjTQM,SmarterEveryDay,Science,How Houdini DIED (in Slow Motion) - Smarter Every Day 108,32853027
MFzDaBzBlL0,SmarterEveryDay,Science,The Backwards Brain Bicycle - Smarter Every Day 133,30402822
JT0wx27J9xs,SmarterEveryDay,Science,"How Hard Can You Hit a Golf Ball? (at 100,000 FPS) - Smarter Every Day 216",21800822
-53kaP6dZeI,SmarterEveryDay,Science,STRAPPED INTO A SINKING HELICOPTER (with U.S. Marines) - Smarter Every Day 201,20653435
Q_F9CxSmGOM,SmarterEveryDay,Science,"World's Longest Home Run (The ""Mad Batter"" Machine) - Smarter Every Day 230",23206421
7pOXunRYJIw,SmarterEveryDay,Science,"See Through Suppressor in Super Slow Motion (110,000 fps) - Smarter Every Day 177",19528216
p1PgNbgWSyY,SmarterEveryDay,Science,GOING SUPERSONIC with U.S. Air Force Thunderbirds! Pulling 7 G's in an F-16 -Smarter Every Day 235,20790407
D0B7F5UbTOQ,SmarterEveryDay,Science,How Laser Tattoo Removal Works - Smarter Every Day 123,16289327
wplX6t4S7p4,SmarterEveryDay,Science,Improvising in Africa. Warning - GROSS - Smarter Every Day 28,14754737
4I-p8vjQ95s,SmarterEveryDay,Science,"Trying to Catch a 1,000 MPH Baseball - Smarter Every Day 247",16595101
I8yJkIuvPvM,SmarterEveryDay,Science,Milking the WORLD'S MOST VENOMOUS FISH! - Smarter Every Day 117,12656458
M2w3NZzPwOM,SmarterEveryDay,Science,Why Snatch Blocks are AWESOME (How Pulleys Work) - Smarter Every Day 228,15868932
cqidD7kVnxY,SmarterEveryDay,Science,World's Fastest Pitch - Supersonic Baseball Cannon - Smarter Every Day 242,14383933
0i5rycLJ3D8,SmarterEveryDay,Science,How to Escape from a Car Window (SLOW MOTION) - Smarter Every Day 144,10918637
_FlV6pgwlrk,SmarterEveryDay,Science,"""YOU WON'T BELIEVE YOUR EYES!"" - Smarter Every Day 142",10957899
o0fG_lnVhHw,SmarterEveryDay,Science,HOW ROCKETS ARE MADE (Rocket Factory Tour - United Launch Alliance) - Smarter Every Day 231,12430445
RXXMJAU6vY8,SmarterEveryDay,Science,Boarding a US NAVY NUCLEAR SUBMARINE in the Arctic - Smarter Every Day 240,13917635
K9_b9X2EA3E,SmarterEveryDay,Science,Inside a Kangaroo Pouch - Smarter Every Day 139,9078441
fvu5FxKuqdQ,SmarterEveryDay,Science,The Infinadeck Omnidirectional Treadmill - Smarter Every Day 192 (VR Series),9283045
_fTC_Ud_k3U,SmarterEveryDay,Science,"Handheld TESLA COIL GUN at 28,000fps - Smarter Every Day 162",8461952
QxZ_iPldGtI,SmarterEveryDay,Science,Where does NASA keep the Moon Rocks? - Smarter Every Day 220,9699051
F5pgG1M_h_U,SomeGoodNews,Science,Some Good News with John Krasinski Ep. 1,19599643
NDjNX3nEfYo,SomeGoodNews,News,The Office Cast Reunites for Zoom Wedding: Some Good News with John Krasinski (Ep. 7),19603266
oilZ1hNZPRM,SomeGoodNews,News,Hamilton Cast Zoom Surprise: Some Good News with John Krasinski (Ep. 2),13892796
VQLi2GYVULc,SomeGoodNews,News,"SGN Prom with Billie Eilish, Jonas Brothers, & Chance the Rapper (Ep. 4)",6711965
Eg08rJGKjtA,SomeGoodNews,News,Baseball Is Back: Some Good News with John Krasinski (Ep. 3),6541599
cqvVL8IurMw,SomeGoodNews,News,"Hamilton Original Broadway Cast Zoom Performance ""Alexander Hamilton""",5274919
JNvpcGV1frQ,SomeGoodNews,News,John Krasinski interviews Steve Carell on Some Good News [FULL INTERVIEW],5458034
o1zIgTwENPg,SomeGoodNews,News,"SGN Potluck with Martha Stewart, Guy Fieri, David Chang, & Stanley Tucci (Ep. 5)",4095937
IweS2CPSnbI,SomeGoodNews,News,"SGN Graduation with Oprah, Steven Spielberg, Jon Stewart, and Malala (Ep. 6)",3804637
TXdKrtmexWU,SomeGoodNews,News,Some Good News with John Krasinski: The SGN Community Episode! (Ep. 8),3518999
6DLU4Gih0gY,SomeGoodNews,News,Sharing Some Good News,2241861
3GwU4GKzLXY,SomeGoodNews,News,Holiday Special with Dwayne Johnson: Some Good News with John Krasinski,2198727
e8_6NEnS41A,SomeGoodNews,News,"Some Good News & The Boston Red Sox: Thank You, Healthcare Heroes!",510857
t7GhemGAZXs,SomeGoodNews,News,NASA Shares Some Good News from the International Space Station,247346
43diGN3pR8U,SomeGoodNews,News,"John Krasinski Hosts Guy Fieri, Martha Stewart, David Chang, and Stanley Tucci for an SGN Potluck",231518
1Za8BtLgKv8,Team Coco,News,"Ice Cube, Kevin Hart And Conan Help A Student Driver | CONAN on TBS",101906034
VNM7Z7hir_I,Team Coco,"Comedy,Entertainment","Ice Cube, Kevin Hart, And Conan Share A Lyft Car | CONAN on TBS",84140928
aztdMwYrF4k,Team Coco,"Comedy,Entertainment",Jean-Claude Van Damme Recreates His “Kickboxer” Dance Scene | CONAN on TBS,53212708
scIizw2asro,Team Coco,"Comedy,Entertainment","Bill Skarsgård's Demonic “IT"" Smile | CONAN on TBS",35413890
Auh74d_OG8Y,Team Coco,"Comedy,Entertainment",Conan Catches Jordan Schlansky Coming In Late | CONAN on TBS,33468902
ty4PhRWt1hU,Team Coco,"Comedy,Entertainment",Nicole Scherzinger Busts Conan For Staring At Her Boobs | CONAN on TBS,31945244
gYgveD5B-V0,Team Coco,"Comedy,Entertainment",Conan Gives Staff Performance Reviews | CONAN on TBS,32665943
YkiR1KjIw7k,Team Coco,"Comedy,Entertainment",Dave Franco & Conan Join Tinder | CONAN on TBS,29170272
ZI8QZ2WN-Xo,Team Coco,"Comedy,Entertainment","Conan Hunts Down His Assistant's Stolen ""Gigolos"" Mug | CONAN on TBS",29260368
48RFno9AQ9A,Team Coco,"Comedy,Entertainment","Kevin Hart: Will Ferrell Is “Cheap As Hell"" | CONAN on TBS",26257572
j_pC0-Jfsq0,Team Coco,"Comedy,Entertainment",Conan Busts His Employees Eating Cake | CONAN on TBS,28956089
ffVbnPjl86A,Team Coco,"Comedy,Entertainment",Conan Hangs Out With His Interns | CONAN on TBS,26470813
jDdKtWnFXFo,Team Coco,"Comedy,Entertainment",Conan Hits The Gym With Kevin Hart | CONAN on TBS,25622617
DiaDblUd-lw,Team Coco,"Comedy,Entertainment",Conan Helps His Assistant Buy A New Car | CONAN on TBS,26302719
2WKkrT4TvBo,Team Coco,"Comedy,Entertainment",Kim & Kanye's Unborn Baby Makes A Run For It | CONAN on TBS,23535257
PmoHSczX8pU,Team Coco,"Comedy,Entertainment",Beth Behrs Accidentally Grabbed Kat Dennings' Boob | CONAN on TBS,26365064
lWctcNBs2qQ,Team Coco,"Comedy,Entertainment",Conan Forces Jordan Schlansky To Clean His Filthy Office | CONAN on TBS,23520960
Rd_BRT6_TPk,Team Coco,"Comedy,Entertainment",Conan Furloughs Non-Essential Staffers | CONAN on TBS,23566854
6A8W77m-ZTw,Team Coco,"Comedy,Entertainment",Conan Busts Jordan Schlansky & His Elitist Espresso Machine | CONAN on TBS,23930005
IiVDtNjORbY,Team Coco,"Comedy,Entertainment","""American Sniper"" Chris Kyle Interview | CONAN on TBS",22928117
LYpKwt4Za_4,Team Coco,"Comedy,Entertainment",Conan Visits Taco Bell | CONAN on TBS,23232850
k70xBg8en-4,Team Coco,"Comedy,Entertainment",Steven Yeun & Conan Visit A Korean Spa | CONAN on TBS,22139611
l6T63M1XiDg,Team Coco,"Comedy,Entertainment",Maria Menounos Is Tight & Can Take A Punch | CONAN on TBS,21550246
OpHYkNlsxPs,Team Coco,"Comedy,Entertainment",Steven Ho Hits Conan With Bruce Lee's One Inch Punch | CONAN on TBS,22655414
fVDOB9mby_w,Team Coco,"Comedy,Entertainment",Conan Takes Jordan Schlansky Coffee Tasting | CONAN on TBS,21767521
EB_XX_IM8io,Team Coco,"Comedy,Entertainment","Conan O'Brien Reviews ""Grand Theft Auto V"" | Clueless Gamer | CONAN on TBS",20920038
eMBFhaxUIew,Team Coco,"Comedy,Entertainment",Animal Expert David Mizejewski: Black Palm Cockatoo & Crocodile | CONAN on TBS,19758887
XfkzEBmx9nc,Team Coco,"Comedy,Entertainment","Melissa Rauch's Accidental ""Big Bang Theory"" Masturbation Scene | CONAN on TBS",20658886
bYs_zn2pTZo,TechLinked,"Tech,Informative",Star Citizen: The Best Game Ever | TechLonger,2695929
IVhoIcvACR4,TechLinked,"Tech,Informative",HA! No One's Buying iPhones!,1751433
AeB3kUk5FBI,TechLinked,"Tech,Informative",Stop Using Zoom.,1500664
9M8FzipwYtk,TechLinked,"Tech,Informative",Now EA's KILLING Playstations...?,1364025
vng1eJyoL5w,TechLinked,"Tech,Informative",I'm ALMOST sad for Apple...,1289601
pZo0r45xxC0,TechLinked,"Tech,Informative",Is This REALLY the RTX 3080??,1170099
CfmzxyvKZ1w,TechLinked,"Tech,Informative","Good luck selling Playstations, Sony!",1165793
a1plyHeIVmE,TechLinked,"Tech,Informative",My earnings leaked online...,1133335
v5y_D875HMQ,TechLinked,"Tech,Informative",Nvidia Actually Did It,1105264
UZzxBbBby1I,TechLinked,"Tech,Informative",Apple's Getting Desparate...,1082934
6TfI7Z2L7Xw,TechLinked,"Tech,Informative",Microsoft made Windows 11 EVEN WORSE…,1041934
2ea1FrrEJD0,TechLinked,"Tech,Informative",Razer wins CES AGAIN,1075706
fPcd2egOQnI,TechLinked,"Tech,Informative",The TINIEST Xbox 💖,997277
H9p4-pzoz-Y,TechLinked,"Tech,Informative",Nvidia's on a roll...,1000785
m-Ob3aq-wrg,TechLinked,"Tech,Informative","Intel's first GPU is ""Super Okay!""",980921
TJM-Qo0VZbs,TechLinked,"Tech,Informative",Is there ANY reason to buy Intel? - TalkLinked #3,971999
thx9hVgrXhQ,TechLinked,"Tech,Informative","Apple, this is ridiculous.",969751
Kd0Fnx0QYhI,TechLinked,"Tech,Informative",1M Subscriber Q+A!,1005582
ipJb4mB5bMA,TechLinked,"Tech,Informative",Apple’s doing WHAT???,959384
EoDd0hRqs6Y,TechLinked,"Tech,Informative",I can only buy ONE PS5??,936326
KqZCFEThVcA,TechLinked,"Tech,Informative",AMD gave up!?,930281
VkDEUeqQUXY,TechLinked,"Tech,Informative","It's over, Intel.",891359
ciW3cGluA10,TechLinked,"Tech,Informative",No More Google!?,885040
GeG3st-2wCE,TechLinked,"Tech,Informative",This phone CAN'T be real...,882717
V2UDvKojIjI,TechLinked,"Tech,Informative","Apple's Big ""F U"" to China",879058
7yub7hDEfzI,TechLinked,"Tech,Informative",Windows 11 is REAL!?,872379
IoaIQSIHuQs,TechLinked,"Tech,Informative",Intel got the Mac Guy.,887552
f38sotYHqtA,Techquickie,Tech,"HDMI, DisplayPort, VGA, and DVI as Fast As Possible",6203840
WXbidC6q5-Y,Techquickie,Tech,Why Does Your Internet Connection Randomly Stop Working?,5151334
3TovcF1j3bE,Techquickie,Tech,What Happens If You Don't Shut Down Your Computer Properly?,4407784
AYaRzp--xyk,Techquickie,Tech,Why Windows is FREE Now,3998688
YXQpgAAeLM4,Techquickie,Tech,How Does Netflix Work?,3874856
qfS8-Qvvmfk,Techquickie,Tech,What Router Settings Should You Change?,3861828
OT-qAQLGkGo,Techquickie,Tech,How Much RAM Do You ACTUALLY Need? (2020),3805015
ooBQIsDTe_M,Techquickie,Tech,What Happens If You Delete System32?,3567664
hqi0114mwtY,Techquickie,Tech,What is Anti Aliasing (AA) as Fast as Possible,3464593
AWkvzycD5PE,Techquickie,Tech,Is PS/2 or USB Better for Keyboards and Mice?,3110628
DRQnZzW_FZU,Techquickie,Tech,Why Can't You Use Phones On Planes?,2816873
_RlxCc0M6Ko,Techquickie,Tech,How to Set Up a Home Media Server,2969716
2LOkI3Xyd_E,Techquickie,Tech,Is Your Internet FAST Enough?,3121140
gShRBsahzXg,Techquickie,Tech,[RANT] The DUMBEST Thing About USB,2775070
L8tdPYqFV7E,Techquickie,Tech,What If You Turn Off Your PC During An Update?,3700156
8i67R5bnb14,Techquickie,Tech,Why Intel is STRUGGLING Against AMD,2629638
F2xv4fba65U,The Daily Show with Trevor Noah,Tech,"Tomi Lahren - Giving a Voice to Conservative America on ""Tomi"": The Daily Show",19216325
uN84HhcdIws,The Daily Show with Trevor Noah,News,White People Unnecessarily Calling the Cops on Black People | The Daily Show,19845221
NzDhm808oU4,The Daily Show with Trevor Noah,News,Jordan Klepper vs. Trump Supporters | The Daily Show,14929224
RskvZgc_s9g,The Daily Show with Trevor Noah,News,Confused Islamophobes Target American Sikhs: The Daily Show,14915216
8A3jiM2FNR8,The Daily Show with Trevor Noah,News,Dr. Fauci Answers Trevor’s Questions About Coronavirus | The Daily Social Distancing Show,11900632
mW-C7WE1xOs,The Daily Show with Trevor Noah,News,Obama Lights Up Donald Trump | The Daily Show,11605390
Y4Zdx97A63s,The Daily Show with Trevor Noah,News,Putting Donald Trump Supporters Through an Ideology Test: The Daily Show,11526517
7OeeHz0uNdM,The Daily Show with Trevor Noah,News,Jordan Klepper vs. Trump Supporters: The Complete Collection | The Daily Social Distancing Show,18028706
QlaeirHJpns,The Daily Show with Trevor Noah,News,Donsplaining | The Daily Show,12602289
btaEDH775ko,The Daily Show with Trevor Noah,News,So Much Winning | The Daily Show,11173121
3QIWolLM9i8,The Daily Show with Trevor Noah,News,Are All Cops Racist?: The Daily Show,10926282
v4amCfVbA_c,The Daily Show with Trevor Noah,News,"George Floyd, Minneapolis Protests, Ahmaud Arbery & Amy Cooper | The Daily Social Distancing Show",9480922
1s5iz6ml-qA,The Daily Show with Trevor Noah,News,"Trevor Chats with His Grandma About Apartheid and Tours Her Home, “MTV Cribs”-Style | The Daily Show",9864263
COD9hcTpGWQ,The Daily Show with Trevor Noah,News,Trevor Responds to Criticism from the French Ambassador - Between The Scenes | The Daily Show,9439625
YVDJqipoohc,The Daily Show with Trevor Noah,News,Jordan Klepper Sees It All at The Capitol Insurrection | The Daily Social Distancing Show,9251006
4b-dannQQ0Q,The Daily Show with Trevor Noah,News,Jordan Klepper vs. Trump Supporters | The Daily Show,9180971
NEoOJ0uRskY,The Daily Show with Trevor Noah,News,World Leaders Caught Talking S**t About Trump | The Daily Show,9115883
kAgTZSJ4jo8,The Daily Show with Trevor Noah,News,How Holy Is Donald Trump? | The Daily Show,9894676
Ym1NLvmcl0k,The Daily Show with Trevor Noah,News,In the Foxhole | The Daily Show,8456301
LoBJOkhtDQQ,The Daily Show with Trevor Noah,News,Eight Times America Surprised Trevor - Between the Scenes | The Daily Show,8455957
4DMEekDsN2M,The Daily Show with Trevor Noah,News,Tomi Lahren's Anger Lights Facebook on Fire: The Daily Show,8065761
sfMUn1U3aSk,The Daily Show with Trevor Noah,News,Jordan Klepper Hits One Last Trump Rally Before the Election | The Daily Social Distancing Show,8306320
qJVhGXSZO9Y,The Daily Show with Trevor Noah,News,Donald and Melania Trump: A Love Story for the Ages | The Daily Social Distancing Show,10257154
2FPrJxTvgdQ,The Daily Show with Trevor Noah,News,Donald Trump - America's African President: The Daily Show,7857918
nV5fXPVeZoQ,The Daily Show with Trevor Noah,News,Fox News Has a Hard Time Processing the Las Vegas Shooting: The Daily Show,7606068
mBbOF8LVCj4,The Daily Show with Trevor Noah,News,Trump Takes India | The Daily Show,9042980
x2YLS80Nmls,The Daily Show with Trevor Noah,News,The Daily Show - Welcome to President Trump's Reality,7513268
QtUgq2Q1ivA,The Daily Show with Trevor Noah,News,How Racist Is Boston? | The Daily Show,8291622
0OGZMfVQROY,The Daily Show with Trevor Noah,News,Trevor Noah Continues the War on Bulls**t: The Daily Show,7306962
3-0-81q-fGo,The Daily Show with Trevor Noah,News,"The Best of Hasan Minhaj - Muslim Ban, Women’s Soccer & Canada | The Daily Show",7518850
UFpGIi2OjX0,The F Word,News,Gordon Ramsay Snaps A Knife! | The F Word With Foxy Games,22621066
7Alory4yIyo,The F Word,Food,"""IT'S GORDON, I'M NOT YOUR MATE"" | The F Word With Foxy Games",6694106
Fokzk5kQR6o,The F Word,Food,Amateur Chef Nearly BLINDS GORDON RAMSAY With Foxy Games,4817847
u8bdtAUpvlA,The F Word,Food,Gordon Ramsay's Top Fish Recipes With Foxy Games,5560774
YfBVm1hh5cM,The F Word,Food,Amateur Chef Gets Into An Argument With Gordon Ramsay & WALKS OUT With Foxy Games,4542479
I-VmHtzFnBY,The F Word,Food,Gordon Ramsay Shows His Poached & Sautéed Chicken Recipe | The F Word With Foxy Games,3159058
SorWwznGdCU,The F Word,Food,Gordon Ramsay Wants Tripe Back On The Menu | The F Word With Foxy Games,3124948
a3Oz3Vz312Y,The F Word,Food,Gordon Cooks A Curry Faster Than Getting A Take-Away | The F Word With Foxy Games,2886503
NB4MhB6vIWQ,The F Word,Food,Gordon Ramsay Gets Jonathan Ross To Kill A Lobster! | The F Word With Foxy Games,2819688
IeVY8u6Y-z4,The F Word,Food,Gordon Ramsay Shows His Chefs How To Make Foie Gras | The F Word With Foxy Games,2647786
rk1fl8RbgyA,The F Word,Food,Amateur Cooks Impress Gordon Ramsay | The F Word With Foxy Games,2495990
oFF134_iokI,The Graham Norton Show,"Entertainment,Comedy",Anthony Joshua DESTROYS Punching Bag Record! | The Graham Norton Show,41203249
Kjp3PTeXBew,The Graham Norton Show,"Entertainment,Comedy",Jennifer Lawrence Shocked By Eddie Redmayne's Early Model Photos - The Graham Norton Show,31436761
UEob1L_tsn0,The Graham Norton Show,"Entertainment,Comedy",Celebrities Impersonating Other Celebrities - The Graham Norton Show,25475368
mfT-UZCA6Tg,The Graham Norton Show,"Entertainment,Comedy",Robert De Niro Impressed By Tom Hiddleston's Robert De Niro Impression - The Graham Norton Show,25506227
Y-orMndwuSE,The Graham Norton Show,"Entertainment,Comedy",All The Best Moments From Season 18 - The Graham Norton Show,24100054
stRtOHjh6lY,The Graham Norton Show,"Entertainment,Comedy","Matt Damon: ""This is the Most Fun I've Ever Had on a Talk Show""",24837011
gBFMGtpfcXw,The Graham Norton Show,"Entertainment,Comedy",Kevin Hart Explains Why Ice Cube Sounds Irish – The Graham Norton Show,21383454
_QWZvU7VCn8,The Graham Norton Show,"Entertainment,Comedy",Brad Pitt Bid $120k For A Night With Emilia Clarke! | The Graham Norton Show,21680567
8vW6qokJ22o,The Graham Norton Show,"Entertainment,Comedy",MORE Celebrities Impersonating Other Celebrities - The Graham Norton Show,21607478
kzJLVWnzLqA,The Graham Norton Show,"Entertainment,Comedy",Emily Blunt Wishes John Krasinski Would Be Less American | The Graham Norton Show,20893750
lIHWgKIXaJU,The Graham Norton Show,"Entertainment,Comedy",Timothée Chalamet Can’t Handle Saoirse Ronan’s Shrek Impression | The Graham Norton Show,21444463
TUJWx7vo44c,The Graham Norton Show,"Entertainment,Comedy",Ewan McGregor Shows Off His Lightsaber Skills | The Graham Norton Show,21306415
iRngp25a8wM,The Graham Norton Show,"Entertainment,Comedy",Ryan Reynolds and Catherine Zeta-Jones Have Some Weird Dating Advice - The Graham Norton Show,16878801
QLFRGj-PPNI,The Graham Norton Show,"Entertainment,Comedy",Tom Cruise Reacts to Slow-Mo Footage of How He Broke His Ankle | The Graham Norton Show,18457626
dmbpagijVkk,The Graham Norton Show,"Entertainment,Comedy",Lee Mack's Joke Leaves John Cleese In Near Tears | The Graham Norton Show,22487692
7a5gM7t8TZo,The Graham Norton Show,"Entertainment,Comedy",Emilia Clarke Mocked Over Her Name - The Graham Norton Show,15465478
6x2dzepmU8o,The Graham Norton Show,"Entertainment,Comedy",Jennifer Lawrence Doesn't Get Eddie Redmayne's Dirty Jokes - The Graham Norton Show,14931946
5BS4JXzq50w,The Graham Norton Show,"Entertainment,Comedy",Jason Momoa Always Visits Emilia Clarke Whenever He's In London | The Graham Norton Show,16133197
iq_6dwYr6YE,The Graham Norton Show,"Entertainment,Comedy","Mila Kunis Constantly Gets Told ""Shut Up Meg"" | The Graham Norton Show CLASSIC CLIP",18879432
_aAZOeftU74,The Graham Norton Show,"Entertainment,Comedy",Dwayne Johnson Asks Kevin Hart What’s It Like Being 3’ 2” | The Graham Norton Show,15470553
9gxC3mhjCEU,The Graham Norton Show,"Entertainment,Comedy",Sexiest Moments On The Couch - Valentine's Day,13990631
WGcqICKfi9Q,The Graham Norton Show,"Entertainment,Comedy",RICKY GERVAIS' FUNNIEST MOMENTS on The Graham Norton Show,16278531
QmMHP6JxU4s,The Graham Norton Show,"Entertainment,Comedy",Tom Hanks On Becoming Forrest Gump - The Graham Norton Show,14596260
yuXGpUR7fXA,The Graham Norton Show,"Entertainment,Comedy",Ryan Gosling Can’t Cope With Greg Davies’ Ridiculous Story - The Graham Norton Show,16418593
UIL9CiUDHp0,The Graham Norton Show,"Entertainment,Comedy",Jennifer Lawrence Cannot Handle Jack Whitehall's Poop Story | The Graham Norton Show,15713403
WLex9xvQycQ,The Graham Norton Show,"Entertainment,Comedy",Anna Kendrick’s Hilarious British Impression | The Graham Norton Show,15777875
icLK1J0n9I0,The Graham Norton Show,"Entertainment,Comedy",Cheryl Cole Shows Off New Bum Tattoo - The Graham Norton Show,12439096
fXUsRIcwtSo,The Graham Norton Show,"Entertainment,Comedy",Jodie Foster Has Never Spoken To Anthony Hopkins - The Graham Norton Show,13761599
GNlQjzje2gw,The Graham Norton Show,"Entertainment,Comedy",Graham's Top 10 Moments From Season 17 - The Graham Norton Show,12884583
BHdezYIgLDE,The Grand Tour,"Entertainment,Comedy",When You Find an Absolute Bargain in the January Sales 💰 #Shorts,44932091
w3jN7kgTVsI,The Grand Tour,"Entertainment,Comedy",Jeremy Clarkson VS An Electric Fence | Clarkson's Farm #Shorts,16723009
jFNHkjsPqE0,The Grand Tour,"Entertainment,Comedy",Jeremy Clarkson Blows Up a Beach! 💥 #Shorts,20362392
kLtpcxtk4HI,The Grand Tour,"Entertainment,Comedy",The Grand Tour | Season 1 | Official Trailer,9591962
v_NRSoVncJQ,The Grand Tour,"Automobile,Comedy",The Grand Tour | Season 2 Official Trailer,8884185
pbRohIxAUS4,The Grand Tour,"Automobile,Comedy",Carnage A Trois SNEAK PEEK! Clarkson On Footballers' Cars ⚽️ #Shorts,17715169
0ssucYoYtYE,The Grand Tour,"Automobile,Comedy",Clarkson Is Astonished By The Self-Driving Tesla Model X | The Grand Tour,10295127
ei43IyseG9Y,The Grand Tour,"Automobile,Comedy",Sergeant Jeremy Clarkson Reporting for Duty 💪 #Shorts,8670121
85GSILNh6U4,The Grand Tour,"Automobile,Comedy","Jeremy Clarkson, Richard Hammond and James May Trying To Be More American | The Grand Tour",6917984
GqkoykvCV1I,The Grand Tour,"Automobile,Comedy",Richard Hammond Parallel Parks The *French* Way 🇫🇷 #Shorts,10702892
RigmjdQQE6g,The Grand Tour,"Automobile,Comedy","Clarkson Shows Off His ""Luxurious Bog"" 🧻 #Shorts",8328591
V12C6xuMwmE,The Grand Tour,"Automobile,Comedy",Porsche 918 vs. Nissan Patrol: Ultimate Showdown | The Grand Tour,6660429
111rmlKjx1Q,The Grand Tour,"Automobile,Comedy",That Time When James May Went Full Hulk Mode 😡 #Shorts,8185943
zjzGlXD6bsQ,The Grand Tour,"Automobile,Comedy",The Grand Tour Presents: Carnage A Trois | Official Trailer,5239289
A0MYr3IqZAY,The Grand Tour,"Automobile,Comedy",Richard Hammond Crashes A $1 Million Rimac Concept One | The Grand Tour,6303657
